Title_x,DOI,Title_y
,10.1097/QAD.0b013e32833d2132,Associations of antiretroviral drug use and HIV-specific risk factors with carotid intima-media thickness
,10.1109/BIBM.2017.8217687,Variable Selection in Heterogeneous Datasets: A Truncated-rank Sparse Linear Mixed Model with Applications to Genome-wide Association Studies
,10.1109/TPAMI.2008.25,Structure inference for Bayesian multisensory scene understanding
Confounding and regression adjustment in difference-in-differences studies,10.1111/1475-6773.13666,
,10.1111/1755-0998.13267,The effect of gene flow from unsampled demes in landscape genetic analysis
,10.1111/1755-0998.13790,Estimating temporally variable selection intensity from ancient DNA data with the flexibility of modelling linkage and epistasis
,10.1111/acer.13844,"Alcohol Outlets, Neighborhood Retail Environments, and Pedestrian Injury Risk"
,10.1111/biom.12203,Confounder selection via penalized credible regions
,10.1111/biom.12622,Model averaged double robust estimation
,10.1111/biom.12679,Outcome-adaptive lasso: Variable selection for causal inference
Doubly robust matching estimators for high dimensional confounding adjustment,10.1111/biom.12887,Doubly robust matching estimators for high dimensional confounding adjustment
Causal inference accounting for unobserved confounding after outcome regression and doubly robust estimation,10.1111/biom.13001,
,10.1111/biom.13135,Data-adaptive longitudinal model selection in causal inference with collaborative targeted minimum loss-based estimation
,10.1111/biom.13231,Doubly robust tests of exposure effects under high-dimensional confounding
,10.1111/biom.13625,Ultra-high dimensional variable selection for doubly robust causal inference
,10.1111/biom.13656,Spatial+: A novel approach to spatial confounding
Bayesian nonparametric adjustment of confounding,10.1111/biom.13833,
,10.1111/biom.13889,Ensuring valid inference for Cox hazard ratios after variable selection
,10.1111/bmsp.12076,Response moderation models for conditional dependence between response time and response accuracy
Assessing moderated mediation in linear models requires fewer confounding assumptions than assessing mediation,10.1111/bmsp.12077,
,10.1111/fwb.14106,What do macroinvertebrate indices measure? Stressor-specific stream macroinvertebrate indices can be confounded by other stressors
,10.1111/j.1467-9531.2010.01224.x,Finite Normal Mixture SEM Analysis by Fitting Multiple Conventional SEM Models
,10.1111/j.1469-1809.2011.00656.x,Selecting SNPs to identify ancestry
,10.1111/j.1539-6924.2009.01303.x,Why reduced-form regression models of health effects versus exposures should not replace QRA: livestock production and infant mortality as an example
The performance of random coefficient regression in accounting for residual confounding,10.1111/j.1541-0420.2005.00510.x,
,10.1111/j.1541-0420.2009.01265.x,A model-based approach for making ecological inference from distance sampling data
,10.1111/j.1541-0420.2011.01731.x,Bayesian effect estimation accounting for adjustment uncertainty
,10.1111/j.1553-2712.2011.01185.x,Logistic regression: a brief primer
,10.1111/jcmm.13132,GC-MS metabolomics-based approach for the identification of a potential VOC-biomarker panel in the urine of renal cell carcinoma patients
,10.1111/mec.16742,Landscape genetics across the Andes mountains: Environmental variation drives genetic divergence in the leaf-cutting ant Atta cephalotes
Selecting a scale for spatial confounding adjustment,10.1111/rssa.12556,
Multiply robust causal inference with double-negative control adjustment for categorical unmeasured confounding,10.1111/rssb.12361,
Estimating the causal effect of treatment in observational studies with survival time end points and unmeasured confounding,10.1111/rssc.12158,
An instrumental variable procedure for estimating Cox models with non-proportional hazards in the presence of unmeasured confounding,10.1111/rssc.12341,
,10.1136/bmj.b4018,Mortality in renal transplant recipients given erythropoietins to increase haemoglobin concentration: cohort study
Handling time varying confounding in observational research,10.1136/bmj.j4587,
Statin adherence and risk of acute cardiovascular events among women: a cohort study accounting for time-dependent confounding affected by previous adherence,10.1136/bmjopen-2016-011306,
,10.1136/bmjresp-2020-000794,Survival models to support shared decision-making about advance care planning for people with advanced stage cystic fibrosis
Controlling for socioeconomic confounding using regression methods,10.1136/jech.49.Suppl_2.S15,
A standardisation approach to the control of socioeconomic confounding in small area studies of environment and health,10.1136/jech.49.Suppl_2.S9,
,10.1136/oem.2005.020420,"The prognostic value of depressive symptoms, fear-avoidance, and self-efficacy for duration of lost-time benefits in workers with musculoskeletal disorders"
,10.1142/S021820251650055X,"Selection, calibration, and validation of models of tumor growth"
,10.1146/annurev-publhealth-031914-122559,Statistical foundations for model-based adjustments
Confounding in health research,10.1146/annurev.publhealth.22.1.189,
,10.1155/2023/9505865,Relationships between Loneliness and Occupational Dysfunction in Community-Dwelling Older Adults: A Cross-Sectional Study
,10.1159/000369831,Assessing risk factors for dental caries: a statistical modeling approach
,10.1159/000380850,"A Bagged, Partially Linear, Tree-Based Regression Procedure for Prediction and Variable Selection"
Propensity Score Methods for Confounding Control in Nonexperimental Research,10.1161/CIRCOUTCOMES.113.000359,
,10.1161/STROKEAHA.108.514935,Disparate stroke rates on warfarin among contemporaneous cohorts with atrial fibrillation: potential insights into risk from a comparative analysis of SPORTIF III versus SPORTIF V
,10.11613/BM.2014.003,Understanding logistic regression analysis
A two-stage model in a Bayesian framework to estimate a survival endpoint in the presence of confounding by indication,10.1177/0962280216660127,
Comparison of statistical approaches dealing with time-dependent confounding in drug effectiveness studies,10.1177/0962280216668554,
,10.1177/0962280216680834,A graphical perspective of marginal structural models: An application for the estimation of the effect of physical activity on blood pressure
Addressing geographic confounding through spatial propensity scores: a study of racial disparities in diabetes,10.1177/0962280217735700,
,10.1177/0962280218767980,A Bayesian two-stage spatially dependent variable selection model for space-time health data
,10.1177/0962280219850595,Propensity score analysis for correlated subgroup effects
,10.1177/0962280219862005,How to obtain valid tests and confidence intervals after propensity score variable selection?
The impact of unmeasured within- and between-cluster confounding on the bias of effect estimatorsof a continuous exposure,10.1177/0962280219883323,
,10.1177/0962280219898497,Variable selection and estimation in causal inference using Bayesian spike and slab priors
,10.1177/0962280220934847,Propensity score specification for optimal estimation of average treatment effect with binary response
Unifying instrumental variable and inverse probability weighting approaches for inference of causal treatment effect and unmeasured confounding in observational studies,10.1177/0962280220971835,
,10.1177/09622802211034219,The change in estimate method for selecting confounders: A simulation study
,10.1177/09622802211051087,Bayesian variable selection in hierarchical difference-in-differences models
Controlling for time-dependent confounding using marginal structural models,10.1177/1536867X0400400403,
Confounding due to changing background risk in adaptively randomized trials,10.1177/1740774511406950,
,10.1186/1297-9686-42-22,Using the realized relationship matrix to disentangle confounding factors for the estimation of genetic variance components of complex traits
,10.1186/1471-2105-13-52,Detecting disease-associated genes with confounding variable adjustment and the impact on genomic meta-analysis: with application to major depressive disorder
,10.1186/1471-2156-11-91,Robust tests for matched case-control genetic association studies
,10.1186/1475-2875-12-416,"Relative importance of climatic, geographic and socio-economic determinants of malaria in Malawi"
,10.1186/1476-072X-6-44,Developing a spatial-statistical model and map of historical malaria prevalence in Botswana using a staged variable selection procedure
,10.1186/1751-0473-3-17,Purposeful selection of variables in logistic regression
,10.1186/gb-2006-7-8-R70,Statistical assessment of the global regulatory role of histone acetylation in Saccharomyces cerevisiae
Feature selection and causal analysis for microbiome studies in the presence of confounding using standardization,10.1186/s12859-021-04232-2,Feature selection and causal analysis for microbiome studies in the presence of confounding using standardization
,10.1186/s12874-016-0159-6,Identification of confounder in epidemiologic data contaminated by measurement error in covariates
Noncollapsibility and its role in quantifying confounding bias in logistic regression,10.1186/s12874-021-01316-8,
"Methodological perspectives on the study of the health effects of unemployment - reviewing the mode of unemployment, the statistical analysis method and the role of confounding factors",10.1186/s12874-022-01670-1,
,10.1186/s12879-023-08185-0,Association between ambient air pollutants and upper respiratory tract infection and pneumonia disease burden in Thailand from 2000 to 2022: a high frequency ecological analysis
,10.1186/s12885-017-3745-z,Perioperative blood transfusion does not affect recurrence-free and overall survivals after curative resection for intrahepatic cholangiocarcinoma: a propensity score matching analysis
,10.1186/s12915-022-01283-6,Assignment of unimodal probability distribution models for quantitative morphological phenotyping
,10.1186/s12942-020-00203-7,A geographic identifier assignment algorithm with Bayesian variable selection to identify neighborhood factors associated with emergency department visit disparities for asthma
The impact of prior distributions for uncontrolled confounding and response bias: A case study of the relation of wire codes and magnetic fields to childhood leukemia,10.1198/01621450338861905,
"Bias, Confounding, and Interaction: Lions and Tigers, and Bears, Oh My!",10.1213/ANE.0000000000002332,
The Importance of Scale for Spatial-Confounding Bias and Precision of Spatial Regression Estimators,10.1214/10-STS326,
Standardization and Control for Confounding in Observational Studies: A Historical Perspective,10.1214/13-STS453,
,10.1214/18-AOS1722,A ROBUST AND EFFICIENT APPROACH TO CAUSAL INFERENCE BASED ON SPARSE SUFFICIENT DIMENSION REDUCTION
High-Dimensional Confounding Adjustment Using Continuous Spike and Slab Priors,10.1214/18-BA1131,
,10.1214/18-ba1131,High-Dimensional Confounding Adjustment Using Continuous Spike and Slab Priors
A CAUSAL EXPOSURE RESPONSE FUNCTION WITH LOCAL ADJUSTMENT FOR CONFOUNDING: ESTIMATING HEALTH EFFECTS OF EXPOSURE TO LOW LEVELS OF AMBIENT FINE PARTICULATE MATTER,10.1214/20-AOAS1330,
MITIGATING UNOBSERVED SPATIAL CONFOUNDING WHEN ESTIMATING THE EFFECT OF SUPERMARKET ACCESS ON CARDIOVASCULAR DISEASE DEATHS,10.1214/20-AOAS1377,
ESTIMATION OF THE MARGINAL EFFECT OF ANTIDEPRESSANTS ON BODY MASS INDEX UNDER CONFOUNDING AND ENDOGENOUS COVARIATE-DRIVEN MONITORING TIMES,10.1214/21-AOAS1570,
BOUNDS ON THE CONDITIONAL AND AVERAGE TREATMENT EFFECT WITH UNOBSERVED CONFOUNDING FACTORS,10.1214/22-AOS2195,
Bias and Confounding: Pharmacoepidemiological Study Using Administrative Database,10.1248/yakushi.15-00006,
Confounding by Socioeconomic Status in Epidemiological Studies of Air Pollution and Health: Challenges and Opportunities,10.1289/EHP7980,
Interpreting population- and family-based genome-wide association studies in the presence of confounding,10.1371/journal.pbio.3002511,
Genetic sensitivity analysis: Adjusting for genetic confounding in epidemiological associations,10.1371/journal.pgen.1009590,
,10.1371/journal.pmed.1002829,Estimating age-stratified influenza-associated invasive pneumococcal disease in England: A time-series model based on population surveillance data
,10.1371/journal.pone.0039423,Model selection in time series studies of influenza-associated mortality
,10.1371/journal.pone.0063475,Model selection approach suggests causal association between 25-hydroxyvitamin D and colorectal cancer
,10.1371/journal.pone.0091840,Selection of higher order regression models in the analysis of multi-factorial transcription data
,10.1371/journal.pone.0163313,Is Geo-Environmental Exposure a Risk Factor for Multiple Sclerosis? A Population-Based Cross-Sectional Study in South-Western Sardinia
Using Rich Data on Comorbidities in Case-Control Study Design with Electronic Health Record Data Improves Control of Confounding in the Detection of Adverse Drug Reactions,10.1371/journal.pone.0164304,Using Rich Data on Comorbidities in Case-Control Study Design with Electronic Health Record Data Improves Control of Confounding in the Detection of Adverse Drug Reactions
,10.1371/journal.pone.0182660,Prognosis impact of clinical characteristics in patients with inoperable esophageal squamous cell carcinoma
"Disentangling personalized treatment effects from ""time-of-the-day"" confounding in mobile health studies",10.1371/journal.pone.0271766,
,10.1371/journal.pone.0289316,Performance of modeling and balancing approach methods when using weights to estimate treatment effects in observational time-to-event settings
Double Bias: Estimation of Causal Effects from Length-Biased Samples in the Presence of Confounding,10.1515/ijb-2014-0037,
,10.1515/sagmb-2015-0072,Finding causative genes from high-dimensional data: an appraisal of statistical and machine learning approaches
,10.1515/sagmb-2017-0044,A Bayesian hierarchical model for identifying significant polygenic effects while controlling for confounding and repeated measures
,10.1534/genetics.109.112391,Likelihood-free inference of population structure and local adaptation in a Bayesian hierarchical model
,10.1534/genetics.114.167056,High-resolution genetic mapping of complex traits from a combined analysis of F2 and advanced intercross mice
,10.1534/genetics.119.301909,Modeling Heterogeneity in the Genetic Architecture of Ethnically Diverse Groups Using Random Effect Interaction Models
Use of causal diagrams in Epidemiology: application to a situation with confounding,10.1590/0102-311X00103115,
,10.2105/ajph.79.3.340,Modeling and variable selection in epidemiologic analysis
Control of confounding in the analysis phase - an overview for clinicians,10.2147/CLEP.S129886,
Adjusting for confounding by indication in observational studies: a case study in traumatic brain injury,10.2147/CLEP.S154500,
,10.2147/CLEP.S166545,Automated data-adaptive analytics for electronic healthcare data to study causal treatment effects
,10.2147/CLEP.S191458,Modeling determinants of satisfaction with health care in youth with inflammatory bowel disease part 2: semiparametric distributional regression
,10.2147/CLEP.S378039,Bayesian Model Averaging to Account for Model Uncertainty in Estimates of a Vaccine's Effectiveness
Effects of Omitting Non-confounding Predictors From General Relative-Risk Models for Binary Outcomes,10.2188/jea.JE20170226,
Causal Modeling to Mitigate Selection Bias and Unmeasured Confounding in Internet-Based Epidemiology of COVID-19: Model Development and Validation,10.2196/31306,Causal Modeling to Mitigate Selection Bias and Unmeasured Confounding in Internet-Based Epidemiology of COVID-19: Model Development and Validation
,10.25302/7.2019.ME.13035638,Methods for Improving Confounding Control in Comparative Effectiveness Research Using Electronic Healthcare Databases
,10.3171/2012.11.JNS12622,Effects of platelet and plasma transfusion on outcome in traumatic brain injury patients with moderate bleeding diatheses
,10.3233/SHTI220463,OntoBioStat: Supporting Causal Diagram Design and Analysis
,10.32614/rj-2020-018,SurvBoost: An R Package for High-Dimensional Variable Selection in the Stratified Proportional Hazards Model via Gradient Boosting
,10.3389/fendo.2021.741248,"Blood Hemoglobin Substantially Modulates the Impact of Gender, Morbid Obesity, and Hyperglycemia on COVID-19 Death Risk: A Multicenter Study in Italy and Spain"
"Confounding and Statistical Significance of Indirect Effects: Childhood Adversity, Education, Smoking, and Anxious and Depressive Symptomatology",10.3389/fpsyg.2017.01317,
,10.3390/ijerph20043182,Causal Model Building in the Context of Cardiac Rehabilitation: A Systematic Review
,10.3760/cma.j.cn112338-20200601-00793,[Matching in observational research: from the directed acyclic graph perspective]
,10.3945/ajcn.115.125914,Best (but oft-forgotten) practices: propensity score methods in clinical nutrition research
,10.4172/2155-6180.1000142,Determining the Probability Distribution and Evaluating Sensitivity and False Positive Rate of a Confounder Detection Method Applied To Logistic Regression
SENSITIVITY ANALYSIS FOR UNMEASURED CONFOUNDING IN COARSE STRUCTURAL NESTED MEAN MODELS,10.5705/ss.202016.0133,
SEMIPARAMETRIC CAUSAL MEDIATION ANALYSIS WITH UNMEASURED MEDIATOR-OUTCOME CONFOUNDING,10.5705/ss.202021.0354,
Reporting on statistical methods to adjust for confounding:: A cross-sectional survey,10.7326/0003-4819-136-2-200201150-00009,
,10.7759/cureus.14188,Lipid Peroxidation With Implication of Organic Pollution in Autistic Behaviors
