Title_x,DOI,Title_y
Variable selection and estimation in causal inference using Bayesian spike and slab priors,10.1177/0962280219898497,Variable selection and estimation in causal inference using Bayesian spike and slab priors
Propensity score specification for optimal estimation of average treatment effect with binary response,10.1177/0962280220934847,
Propensity score weighting under limited overlap and model misspecification,10.1177/0962280220940334,
Unifying instrumental variable and inverse probability weighting approaches for inference of causal treatment effect and unmeasured confounding in observational studies,10.1177/0962280220971835,
The change in estimate method for selecting confounders: A simulation study,10.1177/09622802211034219,The change in estimate method for selecting confounders: A simulation study
Bayesian variable selection in hierarchical difference-in-differences models,10.1177/09622802211051087,Bayesian variable selection in hierarchical difference-in-differences models
A potential outcomes approach to defining and estimating gestational age-specific exposure effects during pregnancy,10.1177/09622802211065158,
An overview of propensity score matching methods for clustered data,10.1177/09622802221133556,
Estimating individualized treatment rules in longitudinal studies with covariate-driven observation times,10.1177/09622802231158733,
Two-stage multivariate Mendelian randomization on multiple outcomes with mixed distributions,10.1177/09622802231181220,
Marginal structural models with latent class growth analysis of treatment trajectories: Statins for primary prevention among older adults,10.1177/09622802231202384,
Improving transportability of randomized controlled trial inference using robust predictionmethods,10.1177/09622802231210944,
Using joint models for longitudinal and time-to-event data to investigate the causal effect of salvage therapy after prostatectomy<pag/>,10.1177/09622802241239003,
Retrospective Cohort Studies in Craniofacial Outcomes Research: An Epidemiologist&apos;s Approach to Mitigating Bias,10.1177/10556656241233234,
"Long-Term Cause-Specific Mortality After Surgery for Women With Breast Cancer: A 20-Year Follow-Up Study From Surveillance, Epidemiology, and End Results Cancer Registries",10.1177/1178223417711429,
Does money buy better health? Unpacking the income to health association after midlife,10.1177/1363459307074694,
Towards non-conventional methods of designing register-based epidemiological studies: An application to pediatric research,10.1177/1403494817702339,
,10.1177/1531003511400427,The impact of diabetes mellitus and renal insufficiency on the outcome of endovascular abdominal aortic aneurysm repair
Controlling for time-dependent confounding using marginal structural models,10.1177/1536867X0400400403,
Implementing double-robust estimators of causal effects,10.1177/1536867X0800800302,
Nonparametric bounds for the causal effect in a binary instrumental-variable model,10.1177/1536867X1101100302,
konfound: Command to quantify robustness of causal inferences,10.1177/1536867X19874223,
"Analysis of Indoor Radon Data Using Bayesian, Random Binning, and Maximum Entropy Methods",10.1177/15593258211009337,
Confounding due to changing background risk in adaptively randomized trials,10.1177/1740774511406950,
Causal Inference and Observational Research: The Utility of Twins,10.1177/1745691610383511,
,10.1177/2047487316649493,The association of depressive symptoms with cardiovascular and all-cause mortality in Central and Eastern Europe: Prospective results of the HAPIEE study
,10.1182/asheducation-2014.1.590,Hepatitis C virus-associated B-cell non-Hodgkin lymphomas
,10.1183/09031936.02.00106402,Obstructive sleep apnoea and urine catecholamines in hypertensive males: a population-based study
,10.1183/20734735.015414,Real-world research and its importance in respiratory medicine
,10.1185/030079906x167660,Risk of cardiovascular events in patients at optimal values for combined lipid parameters
,10.1185/03007990802215844,Study of anemia in long-term care (SALT): prevalence of anemia and its relationship with the risk of falls in nursing home residents
,10.1185/030079908X260989,"Determinants of atypical antipsychotic use among antipsychotic users in community-dwelling elderly, 1996-2004"
,10.1185/03007995.2012.684045,Glycemic effectiveness and medication adherence with fixed-dose combination or coadministered dual therapy of antihyperglycemic regimens: a meta-analysis
,10.1186/1471-2105-13-52,Detecting disease-associated genes with confounding variable adjustment and the impact on genomic meta-analysis: with application to major depressive disorder
,10.1186/1471-2105-14-258,Differential expression analysis with global network adjustment
,10.1186/1471-2288-11-132,Benefits of ICU admission in critically ill patients: whether instrumental variable methods or propensity scores should be used
,10.1186/1471-2288-12-156,Combining directed acyclic graphs and the change-in-estimate procedure as a novel approach to adjustment-variable selection in epidemiology
,10.1186/1471-2288-13-101,A counterfactual approach to bias and effect modification in terms of response types
Reducing bias through directed acyclic graphs,10.1186/1471-2288-8-70,
,10.1186/1471-2377-11-33,"Health-related quality of life in adults with epilepsy: the effect of age, age at onset and duration of epilepsy in a multicentre Italian study"
,10.1186/1471-2393-12-54,Risk adjustment models for interhospital comparison of CS rates using Robson's ten group classification system and other socio-demographic and clinical variables
,10.1186/1471-2407-14-821,A retrospective cohort study of patients with stomach and liver cancers: the impact of comorbidity and ethnicity on cancer care and outcomes
,10.1186/1471-244X-8-1,Postnatal depression in Southern Brazil: prevalence and its demographic and socioeconomic determinants
,10.1186/1471-2458-10-312,Neighborhood and weight-related health behaviors in the Look AHEAD (Action for Health in Diabetes) study
,10.1186/1471-2458-10-96,Determinants of male reproductive health disorders: the Men in Australia Telephone Survey (MATeS)
,10.1186/1471-2458-12-1102,"A cross-sectional study of the relationship between job demand-control, effort-reward imbalance and cardiovascular heart disease risk factors"
,10.1186/1471-2458-12-890,Atopic dermatitis and indoor use of energy sources in cooking and heating appliances
,10.1186/1471-2458-14-1103,Evaluating the impact of environmental interventions across 2 countries: the International Bikeshare Impacts on Cycling and Collisions Study (IBICCS) Study protocol
,10.1186/1471-2458-3-41,Racial differences in influenza vaccination among older Americans 1996-2000: longitudinal analysis of the Health and Retirement Study (HRS) and the Asset and Health Dynamics Among the Oldest Old (AHEAD) survey
,10.1186/1471-2458-6-84,"Acute health effects of the Tasman Spirit oil spill on residents of Karachi, Pakistan"
,10.1186/1471-2458-8-170,Impact of socio-economic factors on stroke prevalence among urban and rural residents in Mainland China
,10.1186/1471-2458-8-254,Socio-economic factors explain differences in public health-related variables among women in Bangladesh: a cross-sectional study
,10.1186/1471-2458-9-1,Relationship between body image disturbance and incidence of depression: the SUN prospective cohort
,10.1186/1472-6963-6-100,"Risk adjustment for inter-hospital comparison of primary cesarean section rates: need, validity and parsimony"
,10.1186/1475-2875-12-416,"Relative importance of climatic, geographic and socio-economic determinants of malaria in Malawi"
,10.1186/1476-069X-13-17,Classification and regression trees for epidemiologic research: an air pollution example
,10.1186/1476-072X-6-44,Developing a spatial-statistical model and map of historical malaria prevalence in Botswana using a staged variable selection procedure
,10.1186/1559-0275-11-32,Validation of a blood protein signature for non-small cell lung cancer
,10.1186/1743-8977-10-34,Combustion-derived flame generated ultrafine soot generates reactive oxygen species and activates Nrf2 antioxidants differently in neonatal and adult rat lungs
,10.1186/1747-597X-6-12,"Adolescents' leisure activities, parental monitoring and cigarette smoking--a cross-sectional study"
,10.1186/1750-9378-8-3,A population-based study of Kaposi Sarcoma-associated herpesvirus seropositivity in Uganda using principal components analysis
,10.1186/s10194-015-0570-0,"Elevated blood pressure and headache disorders in China--associations, under-treatment and implications for public health"
,10.1186/s12199-019-0772-1,"Factors associated with risky driving behaviors for road traffic crashes among professional car drivers in Bahirdar city, northwest Ethiopia, 2016: a cross-sectional study"
Causal relationship between dietary salt intake and dementia risk: Mendelian randomization study,10.1186/s12263-024-00741-w,
Feature selection and causal analysis for microbiome studies in the presence of confounding using standardization,10.1186/s12859-021-04232-2,
,10.1186/s12859-023-05171-w,A generalized covariate-adjusted top-scoring pair algorithm with applications to diabetic kidney disease stage classification in the Chronic Renal Insufficiency Cohort (CRIC) Study
,10.1186/s12859-023-05202-6,Propensity scores as a novel method to guide sample allocation and minimize batch effects during the design of high throughput experiments
,10.1186/s12868-022-00713-z,Higher dietary glycemic load is inversely associated with stress prevalence among Iranian adults
,10.1186/s12872-022-02685-8,The correlation of atherosclerosis and triglyceride glucose index: a secondary analysis of a national cross-sectional study of Japanese
,10.1186/s12873-020-00348-5,Prevalence and determinants of post-traumatic stress disorder among road traffic accident survivors: a prospective survey at selected hospitals in southern Ethiopia
An application of propensity score weighting to quantify the causal effect of rectal sexually transmitted infections on incident HIV among men who have sex with men,10.1186/s12874-015-0017-y,
Statistical power in parallel group point exposure studies with time-to-event outcomes: an empirical comparison of the performance of randomized controlled trials and the inverse probability of treatment weighting (IPTW) approach,10.1186/s12874-015-0081-3,
Identification of confounder in epidemiologic data contaminated by measurement error in covariates,10.1186/s12874-016-0159-6,
,10.1186/s12874-016-0206-3,A simulation study on matched case-control designs in the perspective of causal diagrams
Double-adjustment in propensity score matching analysis: choosing a threshold for considering residual imbalance,10.1186/s12874-017-0338-0,
Application of a new dietary pattern analysis method in nutritional epidemiology,10.1186/s12874-018-0585-8,Application of a new dietary pattern analysis method in nutritional epidemiology
A review of the use of propensity score diagnostics in papers published in high-ranking medical journals,10.1186/s12874-020-00994-0,
,10.1186/s12874-020-01058-z,Directed acyclic graphs and causal thinking in clinical risk prediction modeling
,10.1186/s12874-020-0914-6,Evaluation of confounding in epidemiologic studies assessing alcohol consumption on the risk of ischemic heart disease
Time dependent hazard ratio estimation using instrumental variables without conditioning on an omitted covariate,10.1186/s12874-021-01245-6,Time dependent hazard ratio estimation using instrumental variables without conditioning on an omitted covariate
Noncollapsibility and its role in quantifying confounding bias in logistic regression,10.1186/s12874-021-01316-8,
,10.1186/s12874-021-01408-5,A novel weighting method to remove bias from within-subject exposure dependency in case-crossover studies
,10.1186/s12874-022-01504-0,Reporting methodological issues of the mendelian randomization studies in health and medical research: a systematic review
Inverse probability weighting to handle attrition in cohort studies: some guidance and a call for caution,10.1186/s12874-022-01533-9,
"Methodological perspectives on the study of the health effects of unemployment - reviewing the mode of unemployment, the statistical analysis method and the role of confounding factors",10.1186/s12874-022-01670-1,"Methodological perspectives on the study of the health effects of unemployment - reviewing the mode of unemployment, the statistical analysis method and the role of confounding factors"
Assessing the effectiveness of empirical calibration under different bias scenarios,10.1186/s12874-022-01687-6,
Should multiple imputation be stratified by exposure group when estimating causal effects via outcome regression in observational studies?,10.1186/s12874-023-01843-6,
Adjusting for outcome risk factors in immigrant datasets: total or direct effects?,10.1186/s12874-023-01861-4,Adjusting for outcome risk factors in immigrant datasets: total or direct effects?
Frameworks for estimating causal effects in observational settings: comparing confounder adjustment and instrumental variables,10.1186/s12874-023-01936-2,
"Negative log-binomial model with optimal robust variance to estimate the prevalence ratio, in cross-sectional population studies",10.1186/s12874-023-01999-1,
Application of causal inference methods in individual-participant data meta-analyses in medicine: addressing data handling and reporting gaps with new proposed reporting guidelines,10.1186/s12874-024-02210-9,
,10.1186/s12875-015-0343-5,Ethnic differences in the association between depression and chronic pain: cross sectional results from UK Biobank
,10.1186/s12876-022-02184-2,Primary tumor resection with or without metastasectomy for left- and right-sided stage IV colorectal cancer: an instrumental variable analysis
,10.1186/s12877-019-1312-y,The impact of early comprehensive geriatric screening on the readmission rate in an acute geriatric ward: a quasi-experimental study
,10.1186/s12877-020-01827-x,Effect of poor glycemic control in cognitive performance in the elderly with type 2 diabetes mellitus: The Mexican Health and Aging Study
,10.1186/s12877-022-02795-0,The association between handgrip strength and depression in cancer survivors: a cross-sectional study
,10.1186/s12877-023-04438-4,Association between frailty and chronic constipation and chronic diarrhea among American older adults: National Health and Nutrition Examination Survey
Evaluating methodological approaches to assess the severity of infection with SARS-CoV-2 variants: scoping review and applications on Belgian COVID-19 data,10.1186/s12879-022-07777-6,
Association between TB delay and TB treatment outcomes in HIV-TB co-infected patients: a study based on the multilevel propensity score method,10.1186/s12879-024-09328-7,Association between TB delay and TB treatment outcomes in HIV-TB co-infected patients: a study based on the multilevel propensity score method
,10.1186/s12882-019-1595-4,Desmopressin and bleeding risk after percutaneous kidney biopsy
,10.1186/s12884-017-1310-z,Association between maternal social deprivation and prenatal care utilization: the PreCARE cohort study
,10.1186/s12884-018-2072-y,"Magnitude of postpartum depression and associated factors among women in Mizan Aman town, Bench Maji zone, Southwest Ethiopia"
,10.1186/s12884-022-04656-5,Study on the correlation between homocysteine-related dietary patterns and gestational diabetes mellitus:a reduced-rank regression analysis study
,10.1186/s12884-023-05848-3,"Unintended pregnancy and its associated factors among women with disabilities in central Sidama National Regional State, Ethiopia: a multilevel analysis"
,10.1186/s12885-017-3745-z,Perioperative blood transfusion does not affect recurrence-free and overall survivals after curative resection for intrahepatic cholangiocarcinoma: a propensity score matching analysis
On the use of flexible excess hazard regression models for describing long-term breast cancer survival: a case-study using population-based cancer registry data,10.1186/s12885-019-5304-2,
Comparative effectiveness of primary tumor resection in patients with stage III pancreatic adenocarcinoma,10.1186/s12885-019-5966-9,Comparative effectiveness of primary tumor resection in patients with stage III pancreatic adenocarcinoma
,10.1186/s12887-021-02745-6,"The determinants of 5th minute low Apgar score among newborns who delivered at public hospitals in Hawassa City, South Ethiopia"
,10.1186/s12887-022-03202-8,Prevalence of and factors associated with acute diarrhea among children under five in rural areas in Ethiopia with and without implementation of community-led total sanitation and hygiene
,10.1186/s12888-019-2205-5,Sexual dysfunction in Chinese rural patients with schizophrenia
G-estimation of causal pathways in vocational rehabilitation for adults with psychotic disorders - a secondary analysis of a randomized trial,10.1186/s12888-021-03349-1,
,10.1186/s12889-015-1788-0,Cross-sectional associations between residential environmental exposures and cardiovascular diseases
,10.1186/s12889-015-1993-x,Is alcohol consumption in older adults associated with poor self-rated health? Cross-sectional and longitudinal analyses from the English Longitudinal Study of Ageing
,10.1186/s12889-015-2598-0,"Why are primary school children overweight and obese? A cross sectional study undertaken in Kinondoni district, Dar-es-salaam"
,10.1186/s12889-015-2623-3,Does the impact of metabolic syndrome on cardiovascular events vary by using different definitions?
,10.1186/s12889-016-2884-5,Prevalence of influenza vaccination and its association with health conditions and risk factors among Kansas adults in 2013: a cross-sectional study
,10.1186/s12889-017-4562-7,"Associations of cause-specific mortality with area level deprivation and travel time to health care in France from 1990 to 2007, a multilevel analysis"
,10.1186/s12889-018-5279-y,Re-look at socioeconomic inequalities in stroke prevalence among urban Chinese: is the inflexion approaching?
,10.1186/s12889-018-6154-6,Impact of maternal ART on mother-to-child transmission (MTCT) of HIV at six weeks postpartum in Rwanda
,10.1186/s12889-019-7077-6,Waist circumference trajectories and risk of type 2 diabetes mellitus in Korean population: the Korean genome and epidemiology study (KoGES)
,10.1186/s12889-019-7593-4,The association between residential density and physical activity among urban adults in regional China
,10.1186/s12889-019-8109-y,"Arts, mental distress, mental health functioning & life satisfaction: fixed-effects analyses of a nationally-representative panel study"
,10.1186/s12889-020-09425-7,Application of Freire's adult education model in modifying the psychological constructs of health belief model in self-medication behaviors of older adults: a randomized controlled trial
,10.1186/s12889-020-10152-2,"Mask use among pedestrians during the Covid-19 pandemic in Southwest Iran: an observational study on 10,440 people"
,10.1186/s12889-021-10600-7,The relationship between socioeconomic position and health literacy among urban and rural adults in regional China
,10.1186/s12889-021-10785-x,Determinants of work capacity (predicted VO(2max)) in non-pregnant women of reproductive age living in rural India
,10.1186/s12889-021-11500-6,Co-distribution of Light At Night (LAN) and COVID-19 incidence in the United States
,10.1186/s12889-023-16721-5,Exposure to pesticides and the risk of hypothyroidism: a systematic review and meta-analysis
The effect of smoking on latent hazard classes of metabolic syndrome using latent class causal analysis method in the Iranian population,10.1186/s12889-023-16863-6,
,10.1186/s12889-024-18577-9,The effect of obesity phenotype changes on cardiovascular outcomes in adults older than 40 years in the prospective cohort of the Tehran lipids and glucose study (TLGS): joint model of longitudinal and time-to-event data
,10.1186/s12891-019-2996-z,Physical and psychosocial work environmental risk factors of low-back pain: protocol for a 1 year prospective cohort study
,10.1186/s12894-017-0305-4,Adjuvant chemotherapy improves survival of patients with high-risk upper urinary tract urothelial carcinoma: a propensity score-matched analysis
Marginal structural models for the estimation of the risk of Diabetes Mellitus in the presence of elevated depressive symptoms and antidepressant medication use in the Women's Health Initiative observational and clinical trial cohorts,10.1186/s12902-015-0049-7,
,10.1186/s12902-022-01225-x,The effects of different physiologic concentrations of prolactin in association with reproductive hormones on the incidence of type 2 diabetes mellitus in men: Tehran Lipid and Glucose Study
,10.1186/s12905-015-0237-7,Are women with complications of an incomplete abortion more likely to be HIV infected than women without complications?
,10.1186/s12905-020-01096-1,"Prevalence and factors associated with early discontinuation rate of Implanon utilization among women who ever used Implanon in Kucha District Gamo Gofa Zone, Southern Ethiopia"
,10.1186/s12912-024-01840-0,The effect of the clinical supervision model on nursing internship students' nursing process-based performance: an experimental study
,10.1186/s12916-017-0874-9,Overcoming intratumoural heterogeneity for reproducible molecular risk stratification: a case study in advanced kidney cancer
,10.1186/s12916-018-1022-x,Antidepressant use and risk of adverse outcomes in people aged 20-64 years: cohort study using a primary care database
,10.1186/s12933-017-0542-6,Target organ damage and incident type 2 diabetes mellitus: the Strong Heart Study
,10.1186/s12933-022-01642-1,Fatty liver index as a predictor for incident type 2 diabetes in community-dwelling adults: longitudinal findings over 12 years
,10.1186/s12933-022-01681-8,Comparison of the effects of triglyceride variability and exposure estimate on clinical prognosis in diabetic patients
,10.1186/s12933-023-01912-6,Plasma metabolite profiles associated with the World Cancer Research Fund/American Institute for Cancer Research lifestyle score and future risk of cardiovascular disease and type 2 diabetes
,10.1186/s12936-015-0630-6,"Malaria incidence from 2005-2013 and its associations with meteorological factors in Guangdong, China"
,10.1186/s12936-015-0709-0,Effect of diagnostic testing on medicines used by febrile children less than five years in 12 malaria-endemic African countries: a mixed-methods study
,10.1186/s12940-018-0402-1,Modeled exposure to tetrachloroethylene-contaminated drinking water and the risk of placenta-related stillbirths: a case-control study from Massachusetts and Rhode Island
Geostatistical modelling of the association between malaria and child growth in Africa,10.1186/s12942-018-0127-y,
,10.1186/s12942-020-00203-7,A geographic identifier assignment algorithm with Bayesian variable selection to identify neighborhood factors associated with emergency department visit disparities for asthma
,10.1186/s12955-021-01703-1,Anxiety and depression are risk factors for recurrent pregnancy loss: a nested case-control study
,10.1186/s12955-021-01895-6,The relationship between health literacy and health-related quality of life among school-aged children in regional China
,10.1186/s12957-022-02837-2,Identifying hepatocellular carcinoma patients with survival benefits from surgery combined with chemotherapy: based on machine learning model
,10.1186/s12963-015-0039-z,Improving the estimation of the burden of risk factors: an illustrative comparison of methods to measure smoking-attributable mortality
Methods for accounting for neighbourhood self-selection in physical activity and dietary behaviour research: a systematic review,10.1186/s12966-020-00947-2,Methods for accounting for neighbourhood self-selection in physical activity and dietary behaviour research: a systematic review
,10.1186/s12978-022-01448-0,Impact of social environment on sexual behaviors of adolescent girls in 12 sub-Saharan African countries: a cross-sectional study
"Clarifying questions about ""risk factors"": predictors versus explanation",10.1186/s12982-018-0080-z,
,10.1186/s12992-018-0371-8,Analyzing the impacts of global trade and investment on non-communicable diseases and risk factors: a critical review of methodological approaches used in quantitative analyses
,10.1186/s13014-020-01522-6,A multi-center analysis of single-fraction versus hypofractionated stereotactic radiosurgery for the treatment of brain metastasis
,10.1186/s13054-016-1208-6,"36th International Symposium on Intensive Care and Emergency Medicine : Brussels, Belgium. 15-18 March 2016"
"A framework for the design, conduct and interpretation of randomised controlled trials in the presence of treatment changes",10.1186/s13063-017-2240-9,
,10.1186/s13071-017-2501-1,Analysis of near infrared spectra for age-grading of wild populations of Anopheles gambiae
,10.1186/s13098-018-0354-1,Association of adiponectin with cognitive function precedes overt diabetes in the Brazilian Longitudinal Study of Adult Health: ELSA
The effect of maternity waiting homes on perinatal mortality is inconclusive: a critical appraisal of existing evidence from Sub-Saharan Africa,10.1186/s13104-021-05501-2,
,10.1186/s13104-023-06606-6,The association between pro-vegetarian dietary pattern and risk of colorectal cancer: a matched case-control study
Conceptual causal framework to assess the effect of SARS-CoV-2 variants on COVID-19 disease severity among hospitalized patients,10.1186/s13690-021-00709-x,Conceptual causal framework to assess the effect of SARS-CoV-2 variants on COVID-19 disease severity among hospitalized patients
,10.1186/s13756-018-0368-3,Characteristics of the antibiotic regimen that affect antimicrobial resistance in urinary pathogens
,10.1186/s40359-017-0193-0,Population levels of wellbeing and the association with social capital
