Title_x,DOI,Title_y
Familial Confounding of the Association Between Maternal Smoking During Pregnancy and Offspring Substance Use and Problems,10.1001/archgenpsychiatry.2011.2107,
Assessing seasonal confounding and model selection bias in air pollution epidemiology using positive and negative control analyses,10.1002/1099-095X(200011/12)11:6<705::AID-ENV444>3.0.CO;2-H,
,10.1002/art.41771,Concerns Regarding P Value-Based Variable Selection of Exposure Variables and Confounding Factors: Comment on the Article by Hawker et al
,10.1002/bimj.200800182,Risk factor adjustment in marginal structural model estimation of optimal treatment regimes
Correction of confounding bias in non-randomized studies by appropriate weighting,10.1002/bimj.201000154,
,10.1002/bimj.201700294,Covariate selection strategies for causal inference: Classification and comparison
Propensity score methods for time-dependent cluster confounding,10.1002/bimj.201900277,
Assessing spatial confounding in cancer disease mapping using R,10.1002/cnr2.1263,
,10.1002/ece3.10045,Season-dependent impact of forage quality on stress in alpine chamois
,10.1002/ece3.9327,Annual variation in breeding success in boreal forest grouse: Four decades of monitoring reveals bottom-up drivers to be more important than predation
,10.1002/ecy.3942,Model selection in occupancy models: Inference versus prediction
Mitigating spatial confounding by explicitly correlating Gaussian random fields,10.1002/env.2727,
Confounded by Sequencing Depth in Association Studies of Rare Alleles,10.1002/gepi.20574,
Summary statistic analyses can mistake confounding bias for heritability,10.1002/gepi.22259,
Intermediate confounding in trio relationships: The importance of complete data in effect size estimation,10.1002/gepi.22294,
Causation and familial confounding as explanations for the associations of polygenic risk scores with breast cancer: Evidence from innovative ICE FALCON and ICE CRISTAL analyses,10.1002/gepi.22556,
,10.1002/hbm.22212,Stochastic dynamic causal modeling of working memory connections in cocaine dependence
,10.1002/hbm.26114,Observing cognitive processes in time through functional MRI model comparison
,10.1002/jps.23066,Applying nonexperimental study approach to analyze historical batch data
,10.1002/pds.2074,The role of the c-statistic in variable selection for propensity score models
,10.1002/pds.2188,Measuring balance and model selection in propensity score methods
Using high-dimensional propensity scores to automate confounding control in a distributed medical product safety surveillance system,10.1002/pds.2328,
,10.1002/pds.3356,Variable selection for propensity score models when estimating treatment effects on multiple outcomes: a simulation study
,10.1002/pds.3506,A review of covariate selection for non-experimental comparative effectiveness research
,10.1002/pds.3574,Propensity score balance measures in pharmacoepidemiology: a simulation study
,10.1002/pds.3773,On the role of marginal confounder prevalence - implications for the high-dimensional propensity score algorithm
,10.1002/pds.5403,A comparison of confounder selection and adjustment methods for estimating causal effects using large healthcare databases
,10.1002/pst.1948,Controlling for confounding via propensity score methods can result in biased estimation of the conditional AUC: A simulation study
,10.1002/pst.2105,On kernel machine learning for propensity score estimation under complex confounding structures
Improved estimation of controlled direct effects in the presence of unmeasured confounding of intermediate variables,10.1002/sim.2057,
,10.1002/sim.2507,An innovative application of Bayesian disease mapping methods to patient safety research: a Canadian adverse medical event study
Diagnostics for confounding in PK/PD models for oxcarbazepine,10.1002/sim.2542,
,10.1002/sim.2681,Seasonal confounding in air pollution and health time-series studies: effect on air pollution effect estimates
Bounds on potential risks and causal risk differences under assumptions about confounding parameters,10.1002/sim.2927,
Use of instrumental variables in the analysis of generalized linear models in the presence of unmeasured confounding with applications to epidemiological research,10.1002/sim.3036,
Efforts to adjust for confounding by neighborhood using complex survey data,10.1002/sim.3946,
,10.1002/sim.4780020107,Log-linear model selections in a rural dental health study
Methods for dealing with time-dependent confounding,10.1002/sim.5686,
,10.1002/sim.5694,Network-based regularization for matched case-control analysis of high-dimensional DNA methylation data
Multiple imputation for handling systematically missing confounders in meta-analysis of individual participant data,10.1002/sim.5894,
,10.1002/sim.5984,The use of propensity score methods with survival or time-to-event outcomes: reporting measures of effect similar to those used in randomized experiments
Using an instrumental variable to test for unmeasured confounding,10.1002/sim.6227,
,10.1002/sim.6271,Controlling for seasonal patterns and time varying confounders in time-series epidemiological models: a simulation study
"A flexible, interpretable framework for assessing sensitivity to unmeasured confounding",10.1002/sim.6973,
A comparison of Bayesian and Monte Carlo sensitivity analysis for unmeasured confounding,10.1002/sim.7298,
Safety surveillance and the estimation of risk in select populations: Flexible methods to control for confounding while targeting marginal comparisons via standardization,10.1002/sim.8410,
,10.1002/sim.9289,Practical recommendations on double score matching for estimating causal effects
,10.1002/sim.9889,A Bayesian multistage spatio-temporally dependent model for spatial clustering and variable selection
,10.1007/s00216-009-3421-5,Time-resolved biomarker discovery in 1H-NMR data using generalized fuzzy Hough transform alignment and parallel factor analysis
Polypharmacy and mortality: new insights from a large cohort of older adults by detection of effect modification by multi-morbidity and comprehensive correction of confounding by indication,10.1007/s00228-017-2266-7,
Different statistical techniques dealing with confounding in observational research: measuring the effect of breast-conserving therapy and mastectomy on survival,10.1007/s00432-019-02919-x,
"Sensitivity analysis for unobserved confounding in causal mediation analysis allowing for effect modification, censoring and truncation",10.1007/s10260-021-00611-4,
,10.1007/s10654-009-9411-2,Variable selection: current practice in epidemiological studies
Selection of confounding variables should not be based on observed associations with exposure,10.1007/s10654-011-9606-1,
"From bad to worse: collider stratification amplifies confounding bias in the ""obesity paradox""",10.1007/s10654-015-0069-7,
"Limitations of individual causal models, causal graphs, and ignorability assumptions, as illustrated by random confounding and design unfaithfulness",10.1007/s10654-015-9995-7,
The meaning of confounding adjustment in the presence of multiple versions of treatment: an application to organ transplantation,10.1007/s10654-019-00484-8,
,10.1007/s10654-019-00529-y,A descriptive review of variable selection methods in four epidemiologic journals: there is still room for improvement
"A Simulation-Based Assessment of Alternative Explanations for Apparent Confounding in ""PM Decomposition"" Studies",10.1007/s10666-022-09829-2,
Sensitivity analysis for unmeasured confounding in a marginal structural Cox proportional hazards model,10.1007/s10985-008-9109-x,
,10.1007/s11222-016-9668-8,Approximate Bayesian inference in semi-mechanistic models
,10.1007/s40264-022-01148-5,High-Dimensional Propensity Score-Adjusted Case-Crossover for Discovering Adverse Drug Reactions from Computerized Administrative Healthcare Databases
Identifying and Addressing Confounding Bias in Violence Prevention Research,10.1007/s40471-019-00195-4,
,10.1016/0895-4356(96)00025-x,Inappropriate use of bivariable analysis to screen risk factors for use in multivariable analysis
Combining ecological and individual variables to reduce confounding by indication: Case study - subarachnoid hemorrhage treatment,10.1016/S0895-4356(00)00251-1,
"Calculating the ""number needed to be exposed"" with adjustment for confounding variables in epidemiological studies",10.1016/S0895-4356(01)00510-8,
,10.1016/j.advnut.2024.100214,Observational Dose-Response Meta-Analysis Methods May Bias Risk Estimates at Low Consumption Levels: The Case of Meat and Colorectal Cancer
"Confounding, causality, and confusion: the role of intermediate variables in interpreting observational studies in obstetrics",10.1016/j.ajog.2017.04.016,
Time-Dependent Confounding in the Study of the Effects of Regular Physical Activity in Chronic Obstructive Pulmonary Disease: An Application of the Marginal Structural Model,10.1016/j.annepidem.2008.05.003,
Confounding by Season in Ecologic Studies of Seasonal Exposures and Outcomes: Examples From Estimates of Mortality Due to Influenza,10.1016/j.annepidem.2009.06.009,
Confounding control in a nonexperimental study of STAR*D data: logistic regression balanced covariates better than boosted CART,10.1016/j.annepidem.2013.01.004,
Trimester-specific association between antibiotics exposure during pregnancy and childhood asthma or wheeze: the role of confounding,10.1016/j.annepidem.2018.10.003,
,10.1016/j.arth.2022.05.027,"Avoiding Systematic Bias in Orthopedics Research Through Informed Variable Selection: A Discussion of Confounders, Mediators, and Colliders"
Variations in prostate biopsy recommendation and acceptance confound evaluation of risk factors for prostate cancer: Examining race and BMI,10.1016/j.canep.2019.101619,
,10.1016/j.csda.2013.10.018,Plasmode simulation for the evaluation of pharmacoepidemiologic methods in complex healthcare databases
,10.1016/j.envint.2018.08.041,Bayesian geostatistical modelling of PM(10) and PM(2.5) surface level concentrations in Europe using high-resolution satellite-derived products
,10.1016/j.envint.2021.106815,A case-cohort study of perinatal exposure to potential endocrine disrupters and the risk of cryptorchidism in the Norwegian HUMIS study
"Implications of nonlinearity, confounding, and interactions for estimating exposure concentration-response functions in quantitative risk analysis",10.1016/j.envres.2020.109638,
,10.1016/j.envres.2022.113897,Assessing urinary phenol and paraben mixtures in pregnant women with and without gestational diabetes mellitus: A case-control study
,10.1016/j.epidem.2020.100415,An evaluation of Hamiltonian Monte Carlo performance to calibrate age-structured compartmental SEIR models to incidence data
Scope of Mendelian randomization to control for unobserved confounding in epidemiology,10.1016/j.gaceta.2021.01.008,
Propensity score methods to control for confounding in observational cohort studies: a statistical primer and application to endoscopy research,10.1016/j.gie.2019.04.236,
Reducing the complexity of high-dimensional environmental data: An analytical framework using LASSO with considerations of confounding for statistical inference,10.1016/j.ijheh.2023.114116,
Adjusting for indirectly measured confounding using large-scale propensity score,10.1016/j.jbi.2022.104204,
A sensitivity analysis using information about measured confounders yielded improved uncertainty assessments for unmeasured confounding,10.1016/j.jclinepi.2007.05.006,
,10.1016/j.jclinepi.2014.08.011,Reporting of covariate selection and balance assessment in propensity score analysis is suboptimal: a systematic review
Birth cohort appeared to confound effect estimates of guideline changes on statin utilization,10.1016/j.jclinepi.2014.10.010,
Adjusting for unmeasured confounding in nonrandomized longitudinal studies: a methodological review,10.1016/j.jclinepi.2017.04.022,
"Approaches to addressing missing values, measurement error, and confounding in epidemiologic studies",10.1016/j.jclinepi.2020.11.006,
,10.1016/j.jcrs.2015.11.011,"Second-generation corneal deformation signal waveform analysis in normal, forme fruste keratoconic, and manifest keratoconic corneas after statistical correction for potentially confounding factors"
Intensive care unit (ICU)-acquired bacteraemia and ICU mortality and discharge: addressing time-varying confounding using appropriate methodology,10.1016/j.jhin.2017.11.011,
,10.1016/j.jmig.2007.06.003,Predictors of leiomyoma recurrence after laparoscopic myomectomy
,10.1016/j.jneumeth.2016.01.003,"Nonlinear association criterion, nonlinear Granger causality and related issues with applications to neuroimage studies"
,10.1016/j.jvs.2014.11.083,Similar failure and patency rates when comparing one- and two-stage basilic vein transposition
,10.1016/j.neuroimage.2016.01.008,Model selection for identifying power-law scaling
,10.1016/j.pecinn.2022.100017,Examining how physician factors influence patient satisfaction during clinical consultations about cancer prognosis and pain
,10.1016/j.ymeth.2018.04.021,Variable selection in heterogeneous datasets: A truncated-rank sparse linear mixed model with applications to genome-wide association studies
,10.1016/j.ympev.2021.107086,Assessing topological congruence among concatenation-based phylogenomic approaches in empirical datasets
"Challenging the utility of polygenic scores for social science: Environmental confounding, downward causation, and unknown biology",10.1017/S0140525X22001145,
"Challenging the utility of polygenic scores for social science: Environmental confounding, downward causation, and unknown biology",10.1017/S0140525X22002394,
Sources of confounding in life course epidemiology,10.1017/S2040174418000582,
,10.1021/acs.jproteome.3c00297,A Functional Bayesian Model for Hydrogen-Deuterium Exchange Mass Spectrometry
Combating Unmeasured Confounding in Cross-Sectional Studies: Evaluating Instrumental-Variable and Heckman Selection Models,10.1037/a0037416,
Confounding in Statistical Mediation Analysis: What It Is and How to Address It,10.1037/cou0000242,
,10.1037/met0000564,Data-driven covariate selection for confounding adjustment by focusing on the stability of the effect estimator
How Do Unobserved Confounding Mediators and Measurement Error Impact Estimated Mediation Effects and Corresponding Statistical Inferences? Introducing the R Package ConMed for Sensitivity Analysis,10.1037/met0000567,
,10.1038/s41467-023-43929-1,High-throughput target trial emulation for Alzheimer's disease drug repurposing with real-world data
,10.1038/s41598-020-79410-y,Nutritional status and anxious and depressive symptoms in anorexia nervosa: a prospective study
,10.1038/srep01815,The benefits of selecting phenotype-specific variants for applications of mixed models in genomics
,10.1046/j.1420-9101.2003.00606.x,Sire coloration influences offspring survival under predation risk in the moorfrog
Abnormal Mineral Metabolism and Mortality in Hemodialysis Patients With Secondary Hyperparathyroidism: Evidence From Marginal Structural Models Used to Adjust for Time-Dependent Confounding,10.1053/j.ajkd.2013.08.011,
Time-Dependent Confounding in the Estimation of Treatment Effects in Randomised Trials with Multimodal Therapies - An Illustration of the Problem of Time-Dependent Confounding by Causal Graphs,10.1055/s-0033-1355405,
,10.1073/pnas.2015577118,Using machine learning to estimate the effect of racial segregation on COVID-19 mortality in the United States
An Introduction to Propensity Score Methods for Reducing the Effects of Confounding in Observational Studies,10.1080/00273171.2011.568786,
,10.1080/01621459.2013.869222,Some Statistical Strategies for DAE-seq Data Analysis: Variable Selection and Modeling Dependencies among Observations
,10.1080/01621459.2013.869498,Uncertainty in Propensity Score Estimation: Bayesian Methods for Variable Selection and Model Averaged Causal Effects
,10.1080/01621459.2014.908125,Regularization Methods for High-Dimensional Instrumental Variables Regression With an Application to Genetical Genomics
Treatment Effect Estimation Under Additive Hazards Models With High-Dimensional Confounding,10.1080/01621459.2021.1930546,
Identifying Effects of Multiple Treatments in the Presence of Unmeasured Confounding,10.1080/01621459.2021.2023551,
Sensitivity to Unobserved Confounding in Studies with Factor-Structured Outcomes,10.1080/01621459.2023.2240053,
De-confounding Causal Inference Using Latent Multiple-Mediator Pathways,10.1080/01621459.2023.2240461,
Examining the Error of Mis-Specifying Nonlinear Confounding Effect With Application on Accelerometer-Measured Physical Activity,10.1080/02701367.2017.1296101,
,10.1080/02770903.2022.2089995,Association of corticosteroid use and attention deficit/hyperactivity disorder in asthmatic children varies by age
Confounding and causation in the epidemiology of lead,10.1080/09603123.2016.1161179,
,10.1080/10408444.2020.1787329,Using Bayesian networks to clarify interpretation of exposure-response regression coefficients: blood lead-mortality association as an example
The effect of confounding variables in studies of lead exposure and IQ,10.1080/10408444.2020.1842851,
,10.1080/10543406.2021.1918140,Comparison of statistical methodologies used to estimate the treatment effect on time-to-event outcomes in observational studies
Meta-analysis of lung cancer in asphalt roofing and paving workers with external adjustment for confounding by coal tar,10.1080/15459620701335035,
Identifying confounding by indication through blinded prospective review,10.1093/aje/154.3.276,
Causal knowledge as a prerequisite for confounding evaluation:: An application to birth defects epidemiology,10.1093/aje/155.2.176,
Is residual confounding a reasonable explanation for the apparent protective effects of beta-carotene found in epidemiologic studies of lung cancer in smokers?,10.1093/aje/155.7.622,
,10.1093/aje/kwad193,Recent Methodological Trends in Epidemiology: No Need for Data-Driven Variable Selection?
,10.1093/aje/kwi208,An application of model-fitting procedures for marginal structural models
Confounding by Dietary Patterns of the Inverse Association Between Alcohol Consumption and Type 2 Diabetes Risk,10.1093/aje/kwp096,
Time-modified Confounding,10.1093/aje/kwp175,
Effects of Socioeconomic and Racial Residential Segregation on Preterm Birth: A Cautionary Tale of Structural Confounding,10.1093/aje/kwp435,
Treatment Effects in the Presence of Unmeasured Confounding: Dealing With Observations in the Tails of the Propensity Score Distribution-A Simulation Study,10.1093/aje/kwq198,
,10.1093/aje/kwr001,Covariate selection in high-dimensional propensity score analyses of treatment effects in small samples
Comparison of Instrumental Variable Analysis Using a New Instrument With Risk Adjustment Methods to Reduce Confounding by Indication,10.1093/aje/kwr448,
A Comparison of Confounding Adjustment Methods for Assessment of Asthma Controller Medication Effectiveness,10.1093/aje/kwt323,
Mediation Analysis With Intermediate Confounding: Structural Equation Modeling Viewed Through the Causal Inference Lens,10.1093/aje/kwu239,
Controlling Time-Dependent Confounding by Health Status and Frailty: Restriction Versus Statistical Adjustment,10.1093/aje/kwu485,
Regularized Regression Versus the High-Dimensional Propensity Score for Confounding Adjustment in Secondary Database Analyses,10.1093/aje/kwv108,Regularized Regression Versus the High-Dimensional Propensity Score for Confounding Adjustment in Secondary Database Analyses
"The ""Dry-Run"" Analysis: A Method for Evaluating Risk Scores for Confounding Control",10.1093/aje/kwx032,
,10.1093/aje/kwx225,Selecting Shrinkage Parameters for Effect Estimation: The Multi-Ethnic Study of Atherosclerosis
Analysis of Longitudinal Studies With Repeated Outcome Measures: Adjusting for Time-Dependent Confounding Using Conventional Methods,10.1093/aje/kwx311,
"Education and Cognitive Aging: Accounting for Selection and Confounding in Linkage of Data From the Danish Registry and Survey of Health, Ageing and Retirement in Europe",10.1093/aje/kwy162,
Sharp sensitivity bounds for mediation under unmeasured mediator-outcome confounding,10.1093/biomet/asw012,
Instrumental variables as bias amplifiers with general outcome and confounding,10.1093/biomet/asx009,
On semiparametric estimation of a path-specific effect in the presence of mediator-outcome confounding,10.1093/biomet/asz063,
Doubly robust methods for handling confounding by cluster,10.1093/biostatistics/kxv041,
Guided Bayesian imputation to adjust for confounding when combining heterogeneous data sources in comparative effectiveness research,10.1093/biostatistics/kxx003,
,10.1093/eurheartj/ehr031,An overview of the objectives of and the approaches to propensity score analyses
"Birthweight, gestational age and familial confounding in sex differences in infant mortality: a matched co-twin control study of Brazilian male-female twin pairs identified by population data linkage",10.1093/ije/dyab242,
"Simultaneous adjustment of uncontrolled confounding, selection bias and misclassification in multiple-bias modelling",10.1093/ije/dyad001,
Investigation of the structure and magnitude of time-varying uncontrolled confounding in simulated cohort data analyzed using g-computation,10.1093/ije/dyad150,
The association between state income inequality and worse health is not confounded by race,10.1093/ije/dyg245,
Does unmeasured confounding influence associations between the retail food environment and body mass index over time? The Coronary Artery Risk Development in Young Adults (CARDIA) study,10.1093/ije/dyx070,
,10.1093/ije/dyy120,Evaluating large-scale propensity score performance through real-world and synthetic data experiments
Commentary: Causal models adjusting for time-varying confounding please send more data,10.1093/ije/dyy300,
Comparative Effectiveness of Prostate Cancer Treatments: Evaluating Statistical Adjustments for Confounding in Observational Data,10.1093/jnci/djq393,
"To Misspecify Is Common, to Probe Misspecification Scientific: Common ""Confounds"" in Pornography Research May Actually Be Predictors",10.1093/joc/jqac012,
Non-agency interventions for causal mediation in the presence of intermediate confounding,10.1093/jrsssb/qkad130,
Using Propensity Score Modeling to Minimize the Influence of Confounding Risks Related to Prenatal Tobacco Exposure,10.1093/ntr/ntq170,
Do confounding or selection factors of residential wiring codes and magnetic fields distort findings of electromagnetic fields studies?,10.1097/00001648-200003000-00019,
Confounding and effect modification in the short-term effects of ambient particles on total mortality: Results from 29 European cities within the APHEA2 project,10.1097/00001648-200109000-00011,
Selection bias and confounding in case-crossover analyses of environmental time-series data,10.1097/00001648-200111000-00013,
Quantifying biases in causal models:: Classical confounding <i>vs</i> collider-stratification bias,10.1097/00001648-200305000-00009,
,10.1097/BSD.0000000000001110,A Retrospective Cohort Study of Effects of Antihypertensive and Anticholinergic Medications on Outcomes Following Elective Posterior Lumbar Spine Surgery
Studies with Many Covariates and Few Outcomes <i>Selecting Covariates and Implementing Propensity</i>-<i>Score</i>-<i>Based Confounding Adjustments</i>,10.1097/EDE.0000000000000069,
Bias Formulas for Estimating Direct and Indirect Effects When Unmeasured Confounding Is Present,10.1097/EDE.0000000000000407,
Diagnostics for Confounding of Time-varying and Other Joint Exposures,10.1097/EDE.0000000000000547,
Variable Selection for Confounding Adjustment in High-dimensional Covariate Spaces When Analyzing Healthcare Databases,10.1097/EDE.0000000000000581,Variable Selection for Confounding Adjustment in High-dimensional Covariate Spaces When Analyzing Healthcare Databases
,10.1097/EDE.0000000000000762,Using Super Learner Prediction Modeling to Improve High-dimensional Propensity Score Estimation
,10.1097/EDE.0000000000001253,Postmyocardial Infarction Statin Exposure and the Risk of Stroke with Weighting for Outcome Misclassification
"Deep Learning-based Propensity Scores for Confounding Control in Comparative Effectiveness Research A Large-scale, Real-world Data Study",10.1097/EDE.0000000000001338,"Deep Learning-based Propensity Scores for Confounding Control in Comparative Effectiveness Research: A Large-scale, Real-world Data Study"
e-Cigarette Use and Combustible Cigarette Smoking Initiation Among Youth <i>Accounting for Time-Varying Exposure and Time-Dependent Confounding</i>,10.1097/EDE.0000000000001491,
Potential confounding by exposure history and prior outcomes - An example from perinatal epidemiology,10.1097/EDE.0b013e31812001e6,
,10.1097/EDE.0b013e31817307dc,Model selection and health effect estimation in environmental epidemiology
A Comparison of Methods to Estimate the Hazard Ratio Under Conditions of Time-varying Confounding and Nonpositivity,10.1097/EDE.0b013e31822549e8,
Effects of Heat Waves on Mortality <i>Effect Modification and Confounding by Air Pollutants</i>,10.1097/EDE.0b013e31828ac01b,
Evaluating sources of bias in observational studies of angiotensin-converting enzyme inhibitor/angiotensin II receptor blocker use during COVID-19: beyond confounding,10.1097/HJH.0000000000002706,
Confounding Control in Healthcare Database Research <i>Challenges and Potential Approaches</i>,10.1097/MLR.0b013e3181dbebe3,
Confounding Adjustment in Comparative Effectiveness Research Conducted Within Distributed Research Networks,10.1097/MLR.0b013e31829b1bb1,
,10.1097/OLQ.0b013e3181d73feb,Inverse probability weighting in sexually transmitted infection/human immunodeficiency virus prevention research: methods for evaluating social and community interventions
