Title_x,DOI,Title_y
Familial Confounding of the Association Between Maternal Smoking During Pregnancy and Offspring Substance Use and Problems,10.1001/archgenpsychiatry.2011.2107,
,10.1001/archinte.163.8.949,Central nervous system active medications and risk for fractures in older women
,10.1001/archinte.167.12.1297,Lower risk of tuberculosis in obesity
,10.1001/archinternmed.2010.440,Serum α-carotene concentrations and risk of death among US Adults: the Third National Health and Nutrition Examination Survey Follow-up Study
,10.1001/archotol.1995.01890080011002,Risk factors for chronic otitis media with effusion in infancy. Each acute otitis media episode induces a high but transient risk
,10.1001/archpedi.156.3.258,Parent-reported environmental exposures and environmental control measures for children with asthma
,10.1001/jama.2009.1146,"Adherence to a Mediterranean diet, cognitive decline, and risk of dementia"
,10.1001/jama.2010.1013,"Delirium in elderly patients and the risk of postdischarge mortality, institutionalization, and dementia: a meta-analysis"
Strengthening the Reporting of Observational Studies in Epidemiology Using Mendelian Randomization: The STROBE-MR Statement,10.1001/jama.2021.18236,
,10.1001/jama.279.5.387,Prognostic significance of the initial electrocardiogram in patients with acute myocardial infarction. GUSTO-I Investigators. Global Utilization of Streptokinase and t-PA for Occluded Coronary Arteries
,10.1001/jamadermatol.2020.4097,"Assessment of Incidence Rate and Risk Factors for Keratoacanthoma Among Residents of Queensland, Australia"
,10.1001/jamainternmed.2021.6990,Association Between Cataract Extraction and Development of Dementia
Association Between Obesity and Cardiovascular Outcomes A Systematic Review and Meta-analysis of Mendelian Randomization Studies,10.1001/jamanetworkopen.2018.3788,Association Between Obesity and Cardiovascular Outcomes: A Systematic Review and Meta-analysis of Mendelian Randomization Studies
,10.1001/jamanetworkopen.2020.5123,Associations of Bariatric Interventions With Micronutrient and Endocrine Disturbances
,10.1001/jamanetworkopen.2022.14639,Association of High-Volume Centers With Survival Outcomes Among Patients With Nontraumatic Out-of-Hospital Cardiac Arrest: A Systematic Review and Meta-Analysis
,10.1001/jamaoncol.2020.2388,"Association of Chemotherapy With Survival in Elderly Patients With Multiple Comorbidities and Estrogen Receptor-Positive, Node-Positive Breast Cancer"
,10.1001/jamapsychiatry.2020.3554,Prescription Opioid Use and Risk for Major Depressive Disorder and Anxiety and Stress-Related Disorders: A Multivariable Mendelian Randomization Analysis
,10.1001/jamapsychiatry.2024.0016,Cognitive Function and Variability in Antipsychotic Drug-Naive Patients With First-Episode Psychosis: A Systematic Review and Meta-Analysis
,10.1001/jamasurg.2014.77,Time to appendectomy and risk of perforation in acute appendicitis
,10.1001/jamasurg.2021.0135,Association Between Anesthesiologist Volume and Short-term Outcomes in Complex Gastrointestinal Cancer Surgery
,10.1002/(sici)1097-0274(199801)33:1<33::aid-ajim5>3.0.co;2-x,"Empirical comparisons of proportional hazards, poisson, and logistic regression modeling of occupational cohort data"
,10.1002/1097-0142(19940601)73:11<2680::aid-cncr2820731105>3.0.co;2-c,Pathologic assessment of tumor regression after preoperative chemoradiotherapy of esophageal carcinoma. Clinicopathologic correlations
Assessing seasonal confounding and model selection bias in air pollution epidemiology using positive and negative control analyses,10.1002/1099-095X(200011/12)11:6<705::AID-ENV444>3.0.CO;2-H,
,10.1002/1348-9585.12070,Presenteeism as a predictor of disability pension: A prospective study among nursing professionals and care assistants in Sweden
,10.1002/14651858.CD008444.pub2,Continuous versus intermittent physiological monitoring for acute stroke
,10.1002/14651858.CD010357.pub2,Physician anaesthetists versus non-physician providers of anaesthesia for surgical patients
,10.1002/14651858.CD010406.pub3,Corticosteroids as adjunctive therapy in the treatment of influenza
,10.1002/14651858.CD012080.pub2,Non-invasive diagnostic tests for Helicobacter pylori infection
Stratification and weighting via the propensity score in estimation of causal treatment effects: a comparative study,10.1002/SIM.1903,
,10.1002/ajim.20335,Comparison of potential adjustment variables representing primary intellectual level in epidemiological studies on neurotoxicity
,10.1002/ajim.20766,Assessing the contribution of working conditions to socioeconomic disparities in health: a commentary
,10.1002/ajim.23542,The role of occupation in SARS-CoV-2 infection within a Brazilian municipality: A test-negative case-control study
,10.1002/art.22614,Risk of congestive heart failure with nonsteroidal antiinflammatory drugs and selective Cyclooxygenase 2 inhibitors: a class effect?
,10.1002/art.22959,"Soft tissue, joint, and bone manifestations of AL amyloidosis: clinical presentation, molecular features, and survival"
SNP-based heritability and selection analyses: Improved models and new results,10.1002/bies.202100170,
Risk Factor Adjustment in Marginal Structural Model Estimation of Optimal Treatment Regimes,10.1002/bimj.200800182,Risk factor adjustment in marginal structural model estimation of optimal treatment regimes
,10.1002/bimj.200810488,Some methods of propensity-score matching had superior performance to others: results of an empirical investigation and Monte Carlo simulations
Estimating Antihypertensive Effects of Combination Therapy in an Observational Study Using Marginal Structural Models,10.1002/bimj.200900025,
Correction of confounding bias in non-randomized studies by appropriate weighting,10.1002/bimj.201000154,
Predictive Bayesian inference and dynamic treatment regimes,10.1002/bimj.201400153,
Inverse-probability-of-treatment weighted estimation of causal parameters in the presence of error-contaminated and time-dependent confounders,10.1002/bimj.201600228,
,10.1002/bimj.201800190,Automatic variable selection for exposure-driven propensity score matching with unmeasured confounders
Estimating treatment effects with partially observed covariates using outcome regression with missing indicators,10.1002/bimj.201900041,
Propensity score methods for time-dependent cluster confounding,10.1002/bimj.201900277,
Simulating longitudinal data from marginal structural models using the additive hazard model,10.1002/bimj.202000040,
"Discussion on ""Correct and logical causal inference for binary and time-to-event outcomes in randomized controlled trials"" by Yi Liu, Bushi Wang, Miao Yang, Jianan Hui, Heng Xu, Siyoen Kil, and Jason C. Hsu",10.1002/bimj.202000320,
Model misspecification and bias for inverse probability weighting estimators of average causal effects,10.1002/bimj.202100118,
,10.1002/bimj.202100237,A comparison of full model specification and backward elimination of potential confounders when estimating marginal and conditional causal effects on binary outcomes from observational data
,10.1002/bjs.11568,Effect of omission of surgery on survival in patients aged 80 years and older with early-stage hormone receptor-positive breast cancer
,10.1002/bjs.9783,Surgical management of patients with colorectal cancer and simultaneous liver and lung metastases
,10.1002/brb3.1402,Association between giant cell glioblastoma and glioblastoma multiforme in the United States: A retrospective cohort study
,10.1002/cam4.1954,Radiotherapy after surgery has significant survival benefits for patients with triple-negative breast cancer
,10.1002/ccd.26479,"Long-term outcomes following drug-eluting stents versus bare metal stents for primary percutaneous coronary intervention: A real-world analysis of 11,181 patients from the british columbia cardiac registry"
Nested doubly robust estimating equations for causal analysis with an incomplete effect modifier,10.1002/cjs.11650,
,10.1002/clc.22953,Association between B-type natriuretic peptide and within-visit blood pressure variability
,10.1002/cncr.21446,"Tobacco smoking, GSTP1 polymorphism, and bladder carcinoma"
,10.1002/cncr.23881,Long-term outcomes and clinicopathologic differences of African-American versus white patients treated with breast conservation therapy for early-stage breast cancer
Evaluating Comparative Effectiveness With Observational Data Endoscopic Ultrasound and Survival in Pancreatic Cancer,10.1002/cncr.28295,Evaluating comparative effectiveness with observational data: endoscopic ultrasound and survival in pancreatic cancer
,10.1002/cncr.28508,Comparative effectiveness of upfront treatment strategies in elderly women with ovarian cancer
,10.1002/cncr.30230,Comparative effectiveness of primary tumor resection in patients with stage IV colon cancer
,10.1002/cncr.30506,Discerning the survival advantage among patients with prostate cancer who undergo radical prostatectomy or radiotherapy: The limitations of cancer registry data
Assessing spatial confounding in cancer disease mapping using R,10.1002/cnr2.1263,
When Can Nonrandomized Studies Support Valid Inference Regarding Effectiveness or Safety of New Medical Treatments?,10.1002/cpt.2255,
The EMPagliflozin compaRative effectIveness and SafEty (EMPRISE) study programme: Design and exposure accrual for an evaluation of empagliflozin in routine clinical care,10.1002/edm2.103,
New training tools for new epidemiologists,10.1002/em.21793,
Mitigating spatial confounding by explicitly correlating Gaussian random fields,10.1002/env.2727,
Statistical methods for the evaluation of health effects of prenatal mercury exposure,10.1002/env.569,
Statistical relationship between hardness of drinking water and cerebrovascular mortality in Valencia:: a comparison of spatiotemporal models,10.1002/env.601,
Controlling the healthy worker effect in the presence of an intermediate variable,10.1002/env.640,
,10.1002/epi4.12519,Epilepsy duration is an independent factor for electrocardiographic changes in pediatric epilepsy
Confounded by Sequencing Depth in Association Studies of Rare Alleles,10.1002/gepi.20574,
Sparse Principal Component Analysis for Identifying Ancestry-Informative Markers in Genome-Wide Association Studies,10.1002/gepi.21621,
A Unified Sparse Representation for Sequence Variant Identification for Complex Traits,10.1002/gepi.21849,
Causal Genetic Inference Using Haplotypes as Instrumental Variables,10.1002/gepi.21940,Causal Genetic Inference Using Haplotypes as Instrumental Variables
,10.1002/gepi.22184,Constrained instruments and their application to Mendelian randomization with pleiotropy
Summary statistic analyses can mistake confounding bias for heritability,10.1002/gepi.22259,
An efficient integrative resampling method for gene-trait association analysis,10.1002/gepi.22271,
Intermediate confounding in trio relationships: The importance of complete data in effect size estimation,10.1002/gepi.22294,
Penalized linear mixed models for structured genetic data,10.1002/gepi.22384,
The X factor: A robust and powerful approach to X-chromosome-inclusive whole-genome association studies,10.1002/gepi.22422,
Adjusting for collider bias in genetic association studies using instrumental variable methods,10.1002/gepi.22455,
Clarifying the causes of consistent and inconsistent findings in genetics,10.1002/gepi.22459,
New proposal to address mediation analysis interrogations by using genetic variants as instrumental variables,10.1002/gepi.22519,
Breast and bowel cancers diagnosed in people 'too young to have cancer': A blueprint for research using family and twin studies,10.1002/gepi.22555,
Causation and familial confounding as explanations for the associations of polygenic risk scores with breast cancer: Evidence from innovative ICE FALCON and ICE CRISTAL analyses,10.1002/gepi.22556,
,10.1002/gps.4186,APOE ε4 allele is associated with worse performance in memory dimensions of the mini-mental state examination: the Bambuí Cohort Study of Aging
Stochastic dynamic causal modeling of working memory connections in cocaine dependence,10.1002/hbm.22212,
STATISTICAL METHODS FOR COST-EFFECTIVENESS ANALYSES THAT USE OBSERVATIONAL DATA: A CRITICAL APPRAISAL TOOL AND REVIEW OF CURRENT PRACTICE,10.1002/hec.2806,
,10.1002/ijc.11356,History of antibiotic use and risk of non-Hodgkin's lymphoma (NHL)
,10.1002/ijc.22624,"Family history of cancer in children with acute leukemia, Hodgkin's lymphoma or non-Hodgkin's lymphoma: the ESCALE study (SFCE)"
,10.1002/ijc.2910410409,Survival patterns for malignant mesothelioma: the SEER experience
Modeling HLA associations with EBV-positive and -negative Hodgkin lymphoma suggests distinct mechanisms in disease pathogenesis,10.1002/ijc.29467,Modeling HLA associations with EBV-positive and -negative Hodgkin lymphoma suggests distinct mechanisms in disease pathogenesis
,10.1002/ijc.31949,Nonaspirin NSAIDs and contralateral breast cancer risk
,10.1002/ijc.33744,Pan-cancer analysis of prognostic metastatic phenotypes
,10.1002/ijc.34141,Racial disparities in epithelial ovarian cancer survival: An examination of contributing factors in the Ovarian Cancer in Women of African Ancestry consortium
The Challenges and Opportunities of Pharmacoepidemiology in Bone Diseases,10.1002/jbm4.10051,
A Guide for Understanding and Designing Mendelian Randomization Studies in the Musculoskeletal Field,10.1002/jbm4.10675,
,10.1002/jbmr.3916,Acetylcholinesterase Inhibitors Are Associated with Reduced Fracture Risk among Older Veterans with Dementia
,10.1002/jcsm.12417,Circulating factors associated with sarcopenia during ageing and after intensive lifestyle intervention
,10.1002/jso.24489,The effect of surgery type on survival and recurrence in very young women with breast cancer
,10.1002/jso.25701,A propensity-score matched analysis of limb salvage vs amputation for osteosarcoma
,10.1002/lt.20254,Graft and patient survival after adult live donor liver transplantation compared to a matched cohort who received a deceased donor transplantation
,10.1002/mds.27177,Development and validation of prognostic survival models in newly diagnosed Parkinson's disease
Reducing bias in pelvic floor disorders research: Using directed acyclic graphs as an aid,10.1002/nau.21183,Reducing bias in pelvic floor disorders research: using directed acyclic graphs as an aid
Instrumental variable methods in comparative safety and effectiveness research,10.1002/pds.1908,
,10.1002/pds.2098,The implications of propensity score variable selection strategies in pharmacoepidemiology: an empirical illustration
Using high-dimensional propensity scores to automate confounding control in a distributed medical product safety surveillance system,10.1002/pds.2328,
Role of disease risk scores in comparative effectiveness research with emerging therapies,10.1002/pds.3231,
,10.1002/pds.3248,Analyzing partially missing confounder information in comparative effectiveness and safety research of therapeutics
Dynamic marginal structural modeling to evaluate the comparative effectiveness of more or less aggressive treatment intensification strategies in adults with type 2 diabetes,10.1002/pds.3253,
,10.1002/pds.3356,Variable selection for propensity score models when estimating treatment effects on multiple outcomes: a simulation study
A review of covariate selection for non-experimental comparative effectiveness research,10.1002/pds.3506,A review of covariate selection for non-experimental comparative effectiveness research
,10.1002/pds.3863,Instrumental variables analysis using multiple databases: an example of antidepressant use and risk of hip fracture
,10.1002/pds.3924,Conditions for confounding of interactions
,10.1002/pds.4015,Methods for using clinical laboratory test results as baseline confounders in multi-site observational database studies when missing data are expected
,10.1002/pds.4109,Polypharmacy and risk of acute pancreatitis
Comparison of the ability of double-robust estimators to correct bias in propensity score matching analysis. A Monte Carlo simulation study,10.1002/pds.4325,
,10.1002/pds.4801,Zostavax vaccine effectiveness among US elderly using real-world evidence: Addressing unmeasured confounders by using multiple imputation after linking beneficiary surveys with Medicare claims
A comparison of confounder selection and adjustment methods for estimating causal effects using large healthcare databases,10.1002/pds.5403,
,10.1002/pds.5412,Transparency of high-dimensional propensity score analyses: Guidance for diagnostics and reporting
How measurements affected by medication use are reported and handled in observational research: A literature review,10.1002/pds.5437,
Systematically exploring repurposing effects of antihypertensives,10.1002/pds.5491,
Machine learning for improving high-dimensional proxy confounder adjustment in healthcare database studies: An overview of the current literature,10.1002/pds.5500,
"High-dimensional propensity scores for empirical covariate selection in secondary database studies: Planning, implementation, and reporting",10.1002/pds.5566,"High-dimensional propensity scores for empirical covariate selection in secondary database studies: Planning, implementation, and reporting"
,10.1002/pds.5796,Use of quantitative bias analysis to evaluate single-arm trials with real-world data external controls
,10.1002/ppul.26590,Multilevel analysis identifying the factors associated with RSV detection in infants admitted for viral bronchiolitis in the era of the COVID-19 pandemic
,10.1002/pros.24429,Are higher pre-diagnosis follicle stimulating hormone levels associated with long-term prostate cancer risk?
,10.1002/pst.1948,Controlling for confounding via propensity score methods can result in biased estimation of the conditional AUC: A simulation study
To use or not to use propensity score matching?,10.1002/pst.2051,
Treatment-specific marginal structural Cox model for the effect of treatment discontinuation,10.1002/pst.2211,
Doubly-robust methods for differences in restricted mean lifetimes using pseudo-observations,10.1002/pst.2223,
Key considerations for choosing a statistical method to deal with incomplete treatment adherence in pragmatic trials,10.1002/pst.2258,
Sample selection bias in evaluation of prediction performance of causal models,10.1002/sam.11559,
Consequences of exposure measurement error for confounder identification in environmental epidemiology,10.1002/sim.1541,
Improved estimation of controlled direct effects in the presence of unmeasured confounding of intermediate variables,10.1002/sim.2057,
,10.1002/sim.2073,Using generalized additive models to reduce residual confounding
Analysing change based on two measures taken under different conditions,10.1002/sim.2198,
A comparison of propensity score methods: A case-study estimating the effectiveness of post-AMI statin use,10.1002/sim.2328,
An innovative application of Bayesian disease mapping methods to patient safety research: A Canadian adverse medical event study,10.1002/sim.2507,
Joint estimation of time-dependent and non-linear effects of continuous covariates on survival,10.1002/sim.2519,
Diagnostics for confounding in PK/PD models for oxcarbazepine,10.1002/sim.2542,
,10.1002/sim.2681,Seasonal confounding in air pollution and health time-series studies: effect on air pollution effect estimates
Individualized treatment rules: Generating candidate clinical trials,10.1002/sim.2888,
Bounds on potential risks and causal risk differences under assumptions about confounding parameters,10.1002/sim.2927,
Use of instrumental variables in the analysis of generalized linear models in the presence of unmeasured confounding with applications to epidemiological research,10.1002/sim.3036,
'Mendelian randomization' equals instrumental variable analysis with genetic instruments,10.1002/sim.3255,
Bayesian propensity score analysis for observational data,10.1002/sim.3460,
A simple G-computation algorithm to quantify the causal effect of a secondary illness on the progression of a chronic disease,10.1002/sim.3629,
,10.1002/sim.3864,Modelling continuous exposures with a 'spike' at zero: a new procedure based on fractional polynomials
Efforts to adjust for confounding by neighborhood using complex survey data,10.1002/sim.3946,
Two-stage instrumental variable methods for estimating the causal odds ratio: Analysis of bias,10.1002/sim.4241,
Variance estimation for stratified propensity score estimators,10.1002/sim.4504,
,10.1002/sim.4780050108,Statistical methods for relating several exposure factors to several diseases in case-heterogeneity studies
,10.1002/sim.4780121101,"A comparison of different matching designs in case-control studies: an empirical example using continuous exposures, continuous confounders and incidence of myocardial infarction"
"Doubly robust estimators of causal exposure effects with missing data in the outcome, exposure or a confounder",10.1002/sim.5643,
Methods for dealing with time-dependent confounding,10.1002/sim.5686,
Network-based regularization for matched case-control analysis of high-dimensional DNA methylation data,10.1002/sim.5694,Network-based regularization for matched case-control analysis of high-dimensional DNA methylation data
The use of propensity scores and observational data to estimate randomized controlled trial generalizability bias,10.1002/sim.5802,The use of propensity scores and observational data to estimate randomized controlled trial generalizability bias
Time-varying effect moderation using the structural nested mean model: estimation using inverse-weighted regression with residuals,10.1002/sim.5892,
Multiple imputation for handling systematically missing confounders in meta-analysis of individual participant data,10.1002/sim.5894,
The use of propensity score methods with survival or time-to-event outcomes: reporting measures of effect similar to those used in randomized experiments,10.1002/sim.5984,The use of propensity score methods with survival or time-to-event outcomes: reporting measures of effect similar to those used in randomized experiments
A marginal structural model for multiple-outcome survival data:assessing the impact of injection drug use on several causes of death in the Canadian Co-infection Cohort,10.1002/sim.6043,
Using structural-nested models to estimate the effect of cluster-level adherence on individual-level outcomes with a three-armed cluster-randomized trial,10.1002/sim.6049,Using structural-nested models to estimate the effect of cluster-level adherence on individual-level outcomes with a three-armed cluster-randomized trial
Targeted learning in real-world comparative effectiveness research with time-varying interventions,10.1002/sim.6099,
Instrumental variable methods for causal inference,10.1002/sim.6128,
Using an instrumental variable to test for unmeasured confounding,10.1002/sim.6227,
,10.1002/sim.6252,Covariance adjustment on propensity parameters for continuous treatment in linear models
,10.1002/sim.6271,Controlling for seasonal patterns and time varying confounders in time-series epidemiological models: a simulation study
,10.1002/sim.6308,Interaction of treatment with a continuous variable: simulation study of power for several methods of analysis
,10.1002/sim.6340,Coupled variable selection for regression modeling of complex treatment patterns in a clinical cancer registry
High-dimensional propensity score algorithm in comparative effectiveness research with time-varying interventions,10.1002/sim.6377,
Bias in estimating the causal hazard ratio when using two-stage instrumental variable methods,10.1002/sim.6470,
"A flexible, interpretable framework for assessing sensitivity to unmeasured confounding",10.1002/sim.6973,
A comparison of Bayesian and Monte Carlo sensitivity analysis for unmeasured confounding,10.1002/sim.7298,
,10.1002/sim.7382,Detection of gene-environment interactions in a family-based population using SCAD
Joint mixed-effects models for causal inference with longitudinal data,10.1002/sim.7567,Joint mixed-effects models for causal inference with longitudinal data
Testing causal effects in observational survival data using propensity score matching design,10.1002/sim.7599,
Relaxed covariate overlap and margin-based causal effect estimation,10.1002/sim.7919,
Should a propensity score model be super? The utility of ensemble procedures for causal adjustment,10.1002/sim.8075,
Sensitivity analyses for average treatment effects when outcome is censored by death in instrumental variable models,10.1002/sim.8117,
Model-based standardization using an outcome model with random effects,10.1002/sim.8182,Model-based standardization using an outcome model with random effects
Causal inference of latent classes in complex survey data with the estimating equation framework,10.1002/sim.8382,
Safety surveillance and the estimation of risk in select populations: Flexible methods to control for confounding while targeting marginal comparisons via standardization,10.1002/sim.8410,
Robust estimation of the causal effect of time-varying neighborhood factors on health outcomes,10.1002/sim.8423,
On the aggregation of published prognostic scores for causal inference in observational studies,10.1002/sim.8489,
A stratified generalized additive model and permutation test for temporal heterogeneity of smoothed bivariate spatial effects,10.1002/sim.8718,
"Bias testing, bias correction, and confounder selection using an instrumental variable model",10.1002/sim.8730,"Bias testing, bias correction, and confounder selection using an instrumental variable model"
Formulating causal questions and principled statistical answers,10.1002/sim.8741,
Accounting for selection bias due to death in estimating the effect of wealth shock on cognition for the Health and Retirement Study,10.1002/sim.8921,
Borrowing from supplemental sources to estimate causal effects from a primary data source,10.1002/sim.9114,
