Title_x,DOI,Title_y
Theoretical Basis of the Test-Negative Study Design for Assessment of Influenza Vaccine Effectiveness,10.1093/aje/kww064,
Correcting for Measurement Error in Time-Varying Covariates in Marginal Structural Models,10.1093/aje/kww068,
"The ""Dry-Run"" Analysis: A Method for Evaluating Risk Scores for Confounding Control",10.1093/aje/kwx032,
Estimating the Comparative Effectiveness of Feeding Interventions in the Pediatric Intensive Care Unit: A Demonstration of Longitudinal Targeted Maximum Likelihood Estimation,10.1093/aje/kwx213,
Selecting Shrinkage Parameters for Effect Estimation The Multi-Ethnic Study of Atherosclerosis,10.1093/aje/kwx225,Selecting Shrinkage Parameters for Effect Estimation: The Multi-Ethnic Study of Atherosclerosis
Invited Commentary: The Need for Cognitive Science in Methodology,10.1093/aje/kwx259,
Understanding Causal Distributional and Subgroup Effects With the Instrumental Propensity Score,10.1093/aje/kwx282,
Analysis of Longitudinal Studies With Repeated Outcome Measures: Adjusting for Time-Dependent Confounding Using Conventional Methods,10.1093/aje/kwx311,
"Parental Unemployment and Offspring Psychotropic Medication Purchases: A Longitudinal Fixed-Effects Analysis of 138,644 Adolescents",10.1093/aje/kwy084,
"Education and Cognitive Aging: Accounting for Selection and Confounding in Linkage of Data From the Danish Registry and Survey of Health, Ageing and Retirement in Europe",10.1093/aje/kwy162,
The Implications of Using Lagged and Baseline Exposure Terms in Longitudinal Causal and Regression Models,10.1093/aje/kwy273,
Nonparametric Bounds for the Risk Function,10.1093/aje/kwz013,
Methodological Challenges When Studying Distance to Care as an Exposure in Health Research,10.1093/aje/kwz121,
Diagnosing Covariate Balance Across Levels of Right-Censoring Before and After Application of Inverse-Probability-of-Censoring Weights,10.1093/aje/kwz136,
,10.1093/annonc/mdr295,Dietary patterns and the risk of esophageal cancer
,10.1093/bib/bbab331,High-dimensional generalized propensity score with application to omics data
,10.1093/bioinformatics/btu375,Preserving biological heterogeneity with a permuted surrogate variable analysis for genomics batch correction
Estimation of local treatment effects under the binary instrumental variable model,10.1093/biomet/asab003,
Searching for robust associations with a multi-environment knockoff filter,10.1093/biomet/asab055,
Instrumental variable estimation of the marginal structural Cox model for time-varying treatments,10.1093/biomet/asab062,
Semiparametric efficient G-estimation with invalid instrumental variables,10.1093/biomet/asad011,
Sharp sensitivity bounds for mediation under unmeasured mediator-outcome confounding,10.1093/biomet/asw012,
A Bayesian view of doubly robust causal inference,10.1093/biomet/asw025,
On falsification of the binary instrumental variable model,10.1093/biomet/asw064,
Instrumental variables as bias amplifiers with general outcome and confounding,10.1093/biomet/asx009,
Semiparametric estimation of structural failure time models in continuous-time processes,10.1093/biomet/asz057,
Measurement errors in the binary instrumental variable model,10.1093/biomet/asz060,
On semiparametric estimation of a path-specific effect in the presence of mediator-outcome confounding,10.1093/biomet/asz063,
Single proxy control,10.1093/biomtc/ujae027,
Nonparametric causal mediation analysis for stochastic interventional (in)direct effects,10.1093/biostatistics/kxac002,
Tree-based subgroup discovery using electronic health record data: heterogeneity of treatment effects for DTG-containing therapies,10.1093/biostatistics/kxad014,
On the equivalence of case-crossover and time series methods in environmental epidemiology,10.1093/biostatistics/kxl013,
,10.1093/biostatistics/kxn010,"Adjusting for selection bias in retrospective, case-control studies"
,10.1093/biostatistics/kxn041,Bayesian graphical models for regression on multiple data sets with different variables
Doubly robust methods for handling confounding by cluster,10.1093/biostatistics/kxv041,
Guided Bayesian imputation to adjust for confounding when combining heterogeneous data sources in comparative effectiveness research,10.1093/biostatistics/kxx003,
Survivor bias in Mendelian randomization analysis,10.1093/biostatistics/kxx050,
,10.1093/braincomms/fcac117,Disentangling Alzheimer's disease neurodegeneration from typical brain ageing using machine learning
Methods for the Selection of Covariates in Nutritional Epidemiology Studies: A Meta-Epidemiological Review,10.1093/cdn/nzz104,
Estimating the Effect of Healthcare-Associated Infections on Excess Length of Hospital Stay Using Inverse Probability-Weighted Survival Curves,10.1093/cid/ciaa136,
,10.1093/cid/ciy908,"Investigating the Impact of Early Valve Surgery on Survival in Staphylococcus aureus Infective Endocarditis Using a Marginal Structural Model Approach: Results of a Large, Prospectively Evaluated Cohort"
An introduction to inverse probability of treatment weighting in observational research,10.1093/ckj/sfab158,
,10.1093/clinids/3.4.668,Methodologic issues in hospital epidemiology. II. Time and accuracy in estimation
,10.1093/clinids/5.6.1033,Antimicrobial resistance in hospital organisms and its relation to antibiotic use
,10.1093/dote/doaa102,Neurodevelopmental outcome in infants with esophageal atresia: risk factors in the first year of life
,10.1093/dote/dox151,Complications during neoadjuvant therapy and prognosis following surgery for esophageal cancer
,10.1093/ehjci/jes154,The prognostic impact of dynamic ventricular dyssynchrony in patients with idiopathic dilated cardiomyopathy and narrow QRS
Burden of Antimicrobial Resistance: Compared to What?,10.1093/epirev/mxab001,
,10.1093/eurpub/ckac141,"Disentangling the association between alcohol consumption and employment status: causation, selection or confounding?"
,10.1093/eurpub/ckad123,The association between type of conception through medically assisted reproduction and childhood cognition: a Danish population-wide cohort study
,10.1093/eurpub/ckp093,"Children's physical activity, TV watching and obesity in Cyprus: the CYKIDS study"
,10.1093/geronb/gbx015,Neighborhood Disadvantage and Biological Aging: Using Marginal Structural Models to Assess the Link Between Neighborhood Census Variables and Epigenetic Aging
,10.1093/heapro/daaa156,Social network moderators of the association between Ghanaian older adults' neighbourhood walkability and social activity
Pancreatic beta-cell function and type 2 diabetes risk: quantify the causal effect using a Mendelian randomization approach based on meta-analyses,10.1093/hmg/dds339,
,10.1093/humrep/deaa113,Adverse childhood experiences are associated with increased risk of miscarriage in a national population-based cohort study in England
,10.1093/humrep/dead166,Spontaneous collapse as a prognostic marker for human blastocysts: a systematic review and meta-analysis
,10.1093/humrep/dew172,Urinary paracetamol and time-to-pregnancy
,10.1093/ije/21.6.1074,"A case-control study of coronary heart disease in Athens, Greece"
,10.1093/ije/27.5.808,High free fatty acid concentration: an independent risk factor for hypertension in the Paris Prospective Study
The use of fractional polynomials to model continuous risk variables in epidemiology,10.1093/ije/28.5.964,
,10.1093/ije/30.5.1138,"Particles, and not gases, are associated with the risk of death in patients with chronic obstructive pulmonary disease"
An overview of relations among causal modelling methods,10.1093/ije/31.5.1030,
,10.1093/ije/dyaa017,Association between the pregnancy exposome and fetal growth
"Short-run effects of poverty on asthma, ear infections and health service use: analysis of the Longitudinal Study of Australian Children",10.1093/ije/dyab059,
Reflection on modern methods: understanding bias and data analytical strategies through DAG-based data simulations,10.1093/ije/dyab096,
Using dagR to identify minimal sufficient adjustment sets and to simulate data based on directed acyclic graphs,10.1093/ije/dyab167,
"Birthweight, gestational age and familial confounding in sex differences in infant mortality: a matched co-twin control study of Brazilian male-female twin pairs identified by population data linkage",10.1093/ije/dyab242,
The population-attributable fraction for time-to-event data,10.1093/ije/dyac217,
"Simultaneous adjustment of uncontrolled confounding, selection bias and misclassification in multiple-bias modelling",10.1093/ije/dyad001,
,10.1093/ije/dyad009,Estimating the effect of physical activity on cognitive function within the UK Biobank cohort
Software Application Profile: The daggle app-a tool to support learning and teaching the graphical rules of selecting adjustment variables using directed acyclic graphs,10.1093/ije/dyad038,
SAS and R code for probabilistic quantitative bias analysis for misclassified binary variables and binary unmeasured confounders,10.1093/ije/dyad053,
,10.1093/ije/dyad102,Identifiability of causal effects in test-negative design studies
Investigation of the structure and magnitude of time-varying uncontrolled confounding in simulated cohort data analyzed using g-computation,10.1093/ije/dyad150,
,10.1093/ije/dyg155,Antidepressant medication use and breast cancer risk: a case-control study
The association between state income inequality and worse health is not confounded by race,10.1093/ije/dyg245,
,10.1093/ije/dyh097,Improving the efficiency of nested case-control studies of interaction by selecting controls using counter matching on exposure
Tools for assessing quality and susceptibility to bias in observational studies in epidemiology: a systematic review and annotated bibliography,10.1093/ije/dym018,
,10.1093/ije/dys220,Association between blood pressure and DNA methylation of retrotransposons and pro-inflammatory genes
"The impact of neighbourhood deprivation on adolescent violent criminality and substance misuse: A longitudinal, quasi-experimental study of the total Swedish population",10.1093/ije/dyt066,
Matched designs and causal diagrams,10.1093/ije/dyt083,
Time series regression studies in environmental epidemiology,10.1093/ije/dyt092,
"Mediation analysis in epidemiology: methods, interpretation and bias",10.1093/ije/dyt127,
Exchangeability in the case-crossover design,10.1093/ije/dyu081,
Network Mendelian randomization: using genetic variants as instrumental variables to investigate mediation in causal pathways,10.1093/ije/dyu176,
Serum bilirubin and the risk of hypertension,10.1093/ije/dyu242,Serum bilirubin and the risk of hypertension
Volunteering and mortality risk: a partner-controlled quasi-experimental design,10.1093/ije/dyx037,
Mortality selection in a genetic sample and implications for association studies,10.1093/ije/dyx041,
Does unmeasured confounding influence associations between the retail food environment and body mass index over time? The Coronary Artery Risk Development in Young Adults (CARDIA) study,10.1093/ije/dyx070,
,10.1093/ije/dyy093,The betaboost package-a software tool for modelling bounded outcome variables in potentially high-dimensional epidemiological data
Evaluating large-scale propensity score performance through real-world and synthetic data experiments,10.1093/ije/dyy120,
Reflection on modern methods: selection bias-a review of recent developments,10.1093/ije/dyy138,Reflection on modern methods: selection bias-a review of recent developments
,10.1093/ije/dyy202,Contextualizing selection bias in Mendelian randomization: how bad is it likely to be?
Mendelian randomization analysis of C-reactive protein on colorectal cancer risk,10.1093/ije/dyy244,
Educational Note: Paradoxical collider effect in the analysis of non-communicable disease epidemiological data: a reproducible illustration and web application,10.1093/ije/dyy275,
Commentary: Causal models adjusting for time-varying confounding please send more data,10.1093/ije/dyy300,
Deep propensity network using a sparse autoencoder for estimation of treatment effects,10.1093/jamia/ocaa346,Deep propensity network using a sparse autoencoder for estimation of treatment effects
,10.1093/jn/133.5.1569S,"Design and quality control issues related to dietary assessment, randomized clinical trials and meta-analysis of field-based studies in developing countries"
"Dietary Intakes of Vegetable Protein, Folate, and Vitamins B-6 and B-12 Are Partially Correlated with Physical Functioning of Dutch Older Adults Using Copula Graphical Models",10.1093/jn/nxz269,
Comparative Effectiveness of Prostate Cancer Treatments: Evaluating Statistical Adjustments for Confounding in Observational Data,10.1093/jnci/djq393,Comparative effectiveness of prostate cancer treatments: evaluating statistical adjustments for confounding in observational data
"To Misspecify Is Common, to Probe Misspecification Scientific: Common ""Confounds"" in Pornography Research May Actually Be Predictors",10.1093/joc/jqac012,
,10.1093/jpepsy/27.1.37,Methodological issues in outcome studies of at-risk infants
Proximal causal inference for complex longitudinal studies,10.1093/jrsssb/qkad020,
Non-agency interventions for causal mediation in the presence of intermediate confounding,10.1093/jrsssb/qkad130,
The impact of directly observed therapy on the efficacy of Tuberculosis treatment: a Bayesian multilevel approach,10.1093/jrsssc/qlad034,
Estimating the causal effects of multiple intermittent treatments with application to COVID-19,10.1093/jrsssc/qlad076,
,10.1093/mutage/geq060,Study design and statistical analysis of data in human population studies with the micronucleus assay
,10.1093/ndt/gfad003,Effectiveness of cold HD for the prevention of HD hypotension and mortality in the general HD population
,10.1093/ndt/gfg230,Analgesic-associated nephropathy in the West of Scotland: a 12-year observational study
,10.1093/ndt/gfn592,The survival advantage for haemodialysis patients taking vitamin D is questioned: findings from the Dialysis Outcomes and Practice Patterns Study
,10.1093/ndt/gfw459,Prediction versus aetiology: common pitfalls and how to avoid them
,10.1093/neuonc/nou104,Survival prediction model of children with diffuse intrinsic pontine glioma based on clinical and radiological criteria
Using Propensity Score Modeling to Minimize the Influence of Confounding Risks Related to Prenatal Tobacco Exposure,10.1093/ntr/ntq170,Using propensity score modeling to minimize the influence of confounding risks related to prenatal tobacco exposure
ANALYSIS OF PROSPECTIVE EPIDEMIOLOGIC STUDIES BY MINIMUM DISTANCE CASE-CONTROL MATCHING,10.1093/oxfordjournals.aje.a112421,
,10.1093/oxfordjournals.aje.a114558,Use of the logistic regression model for the analysis of proportionate mortality data
SIMULATION STUDY OF CONFOUNDER-SELECTION STRATEGIES,10.1093/oxfordjournals.aje.a116813,
RISK ATTRIBUTION AND TOBACCO-RELATED DEATHS,10.1093/oxfordjournals.aje.a116835,
ASSESSMENT OF ECOLOGIC REGRESSION IN TILE STUDY OF LUNG-CANCER AND INDOOR RADON,10.1093/oxfordjournals.aje.a116999,
ENERGY ADJUSTMENT METHODS FOR NUTRITIONAL EPIDEMIOLOGY - THE EFFECT OF CATEGORIZATION,10.1093/oxfordjournals.aje.a117000,
,10.1093/oxfordjournals.aje.a117268,Risk factors for enamel fluorosis in a fluoridated population
Evaluation of Complementary and Integrative Health Approaches Among US Veterans with Musculoskeletal Pain Using Propensity Score Methods,10.1093/pm/pny027,
,10.1093/rheumatology/keu384,Development and validation of a new algorithm for attribution of neuropsychiatric events in systemic lupus erythematosus
Does Population Density and Neighborhood Deprivation Predict Schizophrenia? A Nationwide Swedish Family-Based Study of 2.4 Million Individuals,10.1093/schbul/sbu105,
Best for Whom? Heterogeneous Treatment Effects of Breastfeeding on Child Development,10.1093/sf/soad075,
The Relationship between Education and Mental Health: New Evidence from a Discordant Twin Study,10.1093/sf/sow035,
Applications of survival analysis in botanical epidemiology,10.1094/PHYTO.2004.94.9.1022,
,10.1097/00000441-200406000-00002,Association between antihypertensive agent use and hospital admissions in a managed care population
,10.1097/00000637-200111000-00001,Association between maternal diabetes mellitus and newborn oral cleft
SOME STATISTICAL CONSIDERATIONS IN THE ANALYSIS OF CASE-CONTROL STUDIES WHEN THE EXPOSURE VARIABLES ARE CONTINUOUS MEASUREMENTS,10.1097/00001648-199403000-00006,
THE EVOLVING CONCEPT OF THE HEALTHY WORKER SURVIVOR EFFECT,10.1097/00001648-199403000-00009,The evolving concept of the healthy worker survivor effect
Do confounding or selection factors of residential wiring codes and magnetic fields distort findings of electromagnetic fields studies?,10.1097/00001648-200003000-00019,Do confounding or selection factors of residential wiring codes and magnetic fields distort findings of electromagnetic fields studies?
Confounding and effect modification in the short-term effects of ambient particles on total mortality: Results from 29 European cities within the APHEA2 project,10.1097/00001648-200109000-00011,
Selection bias and confounding in case-crossover analyses of environmental time-series data,10.1097/00001648-200111000-00013,
Quantifying biases in causal models:: Classical confounding <i>vs</i> collider-stratification bias,10.1097/00001648-200305000-00009,
,10.1097/00001888-199602000-00030,Determinants of the generalist career intentions of 1995 graduating medical students
,10.1097/00002030-199904160-00011,"Trends and interaction of HIV-1 and HIV-2 in Guinea-Bissau, west Africa: no protection of HIV-2 against HIV-1 infection"
,10.1097/00002030-200307040-00014,HIV infection and chronic chest disease as risk factors for bacterial pneumonia: a case-control study
,10.1097/00005373-199707000-00028,Previous trauma as a risk factor for recurrent trauma in rural northern Israel
,10.1097/00005650-199908000-00003,Increased risk of death in patients with do-not-resuscitate orders
,10.1097/00006534-200002000-00001,Maternal cigarette smoking during pregnancy and the risk of having a child with cleft lip/palate
,10.1097/00042560-199804010-00007,Laboratory test differences associated with HTLV-I and HTLV-II infection. Retrovirus Epidemiology Donor Study Investigators
,10.1097/01.CCM.0000098031.24329.10,Impact of adequate empirical antibiotic therapy on the outcome of patients admitted to the intensive care unit with sepsis
,10.1097/01.CCM.0000251134.96055.A6,Tracheostomy does not improve the outcome of patients requiring prolonged mechanical ventilation: a propensity analysis
,10.1097/01.JGP.0000218324.78202.25,Social support and suicidal ideation in older adults using home healthcare services
,10.1097/01.asn.0000013294.11876.80,Trends in anemia management among US hemodialysis patients
Effects of physical activity and body composition on functional limitation in the elderly - Application of the marginal structural model,10.1097/01.ede.0000128401.55545.c6,
,10.1097/01.ede.0000128402.86336.7e,Evaluation of uncontrolled confounding in studies of environmental exposures and neurobehavioral testing in children
A structural approach to selection bias,10.1097/01.ede.0000135174.63482.43,A structural approach to selection bias
,10.1097/01.ede.0000152904.95284.0f,Mental vulnerability as a predictor of early mortality
,10.1097/01.ede.0000165820.08301.b3,Ozone exposure and mortality: an empiric bayes metaregression analysis
,10.1097/01.ede.0000256320.30737.c0,Bayesian methods for highly correlated exposure data
,10.1097/01.ta.0000103988.66443.0e,Hospital factors associated with splenectomy for splenic injury: a national perspective
,10.1097/ACM.0b013e318272f5e7,The prevalence and effects of environmental tobacco smoke exposure among inner-city children: lessons for pediatric residents
,10.1097/ALN.0b013e3181d3d4b4,Role of intraoperative and postoperative blood glucose concentrations in predicting outcomes after cardiac surgery
,10.1097/AOG.0000000000001194,Influence of Lymphadenectomy on Survival for Early-Stage Endometrial Cancer
,10.1097/AUD.0000000000000137,Hearing Impairment in Relation to Severity of Diabetes in a Veteran Cohort
,10.1097/BRS.0000000000000499,Surgeon specialty differences in single-level anterior cervical discectomy and fusion
,10.1097/BRS.0000000000004514,Propensity-matched Comparison Between Chronic Nonspecific Low Back Pain and Axial Spondyloarthritis: Impact on patient-perceived Quality of Life
,10.1097/CCM.0b013e318196227d,Incidence and risk factors of corneal epithelial defects in mechanically ventilated children
,10.1097/CCM.0b013e31819da8c7,Benefit of antiretroviral therapy on survival of human immunodeficiency virus-infected patients admitted to an intensive care unit
,10.1097/CCM.0b013e31820a8581,Relationship of catheter-associated urinary tract infection to mortality and length of stay in critically ill patients: a systematic review and meta-analysis of observational studies
,10.1097/CMR.0000000000000582,A population-based study of the treatment effect of first-line ipilimumab for metastatic or unresectable melanoma
,10.1097/CORR.0000000000000493,Statistical Methods Dictate the Estimated Impact of Body Mass Index on Major and Minor Complications After Total Joint Arthroplasty
,10.1097/CORR.0000000000000728,Drain Use is Associated with Increased Odds of Blood Transfusion in Total Shoulder Arthroplasty: A Population-Based Study
,10.1097/CORR.0000000000001513,"Perioperative Blood Transfusions Are Associated with a Higher Incidence of Thromboembolic Events After TKA: An Analysis of 333,463 TKAs"
,10.1097/CORR.0000000000001616,What Factors Are Associated with Increased Financial Burden and High Financial Worry For Patients Undergoing Common Hand Procedures?
,10.1097/CORR.0000000000001823,Is Uncontrolled Diabetes Mellitus Associated with Incidence of Complications After Posterior Instrumented Lumbar Fusion? A National Claims Database Analysis
,10.1097/CORR.0000000000002322,Reoperation Rates of Microendoscopic Discectomy Compared With Conventional Open Lumbar Discectomy: A Large-database Study
,10.1097/DCR.0000000000001001,A Variant of COL3A1 (rs3134646) Is Associated With Risk of Developing Diverticulosis in White Men
,10.1097/DCR.0000000000001590,"Predictors for Anastomotic Leak, Postoperative Complications, and Mortality After Right Colectomy for Cancer: Results From an International Snapshot Audit"
Studies with Many Covariates and Few Outcomes <i>Selecting Covariates and Implementing Propensity</i>-<i>Score</i>-<i>Based Confounding Adjustments</i>,10.1097/EDE.0000000000000069,
,10.1097/EDE.0000000000000237,Variable selection for propensity score estimation via balancing covariates
Instrumental Variable Estimation in a Survival Context,10.1097/EDE.0000000000000262,
Bias Formulas for Estimating Direct and Indirect Effects When Unmeasured Confounding Is Present,10.1097/EDE.0000000000000407,
Selection Bias Due to Loss to Follow Up in Cohort Studies,10.1097/EDE.0000000000000409,
Collider Bias Is Only a Partial Explanation for the Obesity Paradox,10.1097/EDE.0000000000000493,Collider Bias Is Only a Partial Explanation for the Obesity Paradox
Does Segregation Lead to Lower Birth Weight? <i>An Instrumental Variable Approach</i>,10.1097/EDE.0000000000000505,
Diagnostics for Confounding of Time-varying and Other Joint Exposures,10.1097/EDE.0000000000000547,
,10.1097/EDE.0000000000000565,Bias Due to Confounders for the Exposure-Competing Risk Relationship
The Trend-in-trend Research Design for Causal Inference,10.1097/EDE.0000000000000579,
Variable Selection for Confounding Adjustment in High-dimensional Covariate Spaces When Analyzing Healthcare Databases,10.1097/EDE.0000000000000581,Variable Selection for Confounding Adjustment in High-dimensional Covariate Spaces When Analyzing Healthcare Databases
Instrumental Variable Analyses and Selection Bias,10.1097/EDE.0000000000000639,
Repair of Partly Misspecified Causal Diagrams,10.1097/EDE.0000000000000659,
Using Super Learner Prediction Modeling to Improve High-dimensional Propensity Score Estimation,10.1097/EDE.0000000000000762,Using Super Learner Prediction Modeling to Improve High-dimensional Propensity Score Estimation
Can We Train Machine Learning Methods to Outperform the High-dimensional Propensity Score Algorithm?,10.1097/EDE.0000000000000787,
Implementation of Instrumental Variable Bounds for Data Missing Not at Random,10.1097/EDE.0000000000000811,Implementation of Instrumental Variable Bounds for Data Missing Not at Random
Analysis of Observational Self-matched Data to Examine Acute Triggers of Outcome Events with Abrupt Onset,10.1097/EDE.0000000000000904,
Limits for the Magnitude of M-bias and Certain Other Types of Structural Selection Bias,10.1097/EDE.0000000000001031,Limits for the Magnitude of M-bias and Certain Other Types of Structural Selection Bias
Bounding Bias Due to Selection,10.1097/EDE.0000000000001032,Bounding Bias Due to Selection
What Is the Causal Interpretation of Sibling Comparison Designs?,10.1097/EDE.0000000000001108,
Quantitative Bias Analysis for a Misclassified Confounder A Comparison Between Marginal Structural Models and Conditional Models for Point Treatments,10.1097/EDE.0000000000001239,
,10.1097/EDE.0000000000001253,Postmyocardial Infarction Statin Exposure and the Risk of Stroke with Weighting for Outcome Misclassification
Inference of Naturally Acquired Immunity Using a Self-matched Negative-Control Design,10.1097/EDE.0000000000001305,
Gestational Weight Gain and Long-term Maternal Obesity Risk: A Multiple-Bias Analysis,10.1097/EDE.0000000000001310,
"To Adjust or Not to Adjust? When a ""Confounder"" Is Only Measured After Exposure",10.1097/EDE.0000000000001312,
"Meaningful Causal Decompositions in Health Equity Research Definition, Identification, and Estimation Through a Weighting Framework",10.1097/EDE.0000000000001319,
